-- phpMyAdmin SQL Dump
-- version 5.0.4
-- https://www.phpmyadmin.net/
--
-- Host: 127.0.0.1
-- Generation Time: Jun 22, 2021 at 02:19 PM
-- Server version: 10.4.17-MariaDB
-- PHP Version: 8.0.1

SET SQL_MODE = "NO_AUTO_VALUE_ON_ZERO";
START TRANSACTION;
SET time_zone = "+00:00";


/*!40101 SET @OLD_CHARACTER_SET_CLIENT=@@CHARACTER_SET_CLIENT */;
/*!40101 SET @OLD_CHARACTER_SET_RESULTS=@@CHARACTER_SET_RESULTS */;
/*!40101 SET @OLD_COLLATION_CONNECTION=@@COLLATION_CONNECTION */;
/*!40101 SET NAMES utf8mb4 */;

--
-- Database: `new_inventory`
--

-- --------------------------------------------------------

--
-- Table structure for table `accounts`
--

CREATE TABLE `accounts` (
  `id` bigint(20) UNSIGNED NOT NULL,
  `name` varchar(255) COLLATE utf8mb4_unicode_ci NOT NULL,
  `account_number` varchar(255) COLLATE utf8mb4_unicode_ci NOT NULL,
  `bank_id` bigint(20) UNSIGNED DEFAULT NULL,
  `account_type_id` bigint(20) UNSIGNED DEFAULT NULL,
  `opening_balance` decimal(22,2) NOT NULL DEFAULT 0.00,
  `debit` decimal(22,2) NOT NULL DEFAULT 0.00,
  `credit` decimal(22,2) NOT NULL DEFAULT 0.00,
  `balance` decimal(22,2) NOT NULL DEFAULT 0.00,
  `remark` mediumtext COLLATE utf8mb4_unicode_ci DEFAULT NULL,
  `status` tinyint(1) NOT NULL DEFAULT 1,
  `admin_id` bigint(20) UNSIGNED DEFAULT NULL,
  `created_at` timestamp NULL DEFAULT NULL,
  `updated_at` timestamp NULL DEFAULT NULL
) ENGINE=InnoDB DEFAULT CHARSET=utf8mb4 COLLATE=utf8mb4_unicode_ci;

--
-- Dumping data for table `accounts`
--

INSERT INTO `accounts` (`id`, `name`, `account_number`, `bank_id`, `account_type_id`, `opening_balance`, `debit`, `credit`, `balance`, `remark`, `status`, `admin_id`, `created_at`, `updated_at`) VALUES
(15, 'Payment Account', '84564574', 2, 2, '0.00', '23506.00', '60889.50', '37383.50', NULL, 1, 1, NULL, '2021-06-17 10:44:49'),
(16, 'Gregory Rowland', '501578787444', 6, 2, '67.00', '935475.50', '25712.01', '-720338.49', 'Tempore earum elige', 1, 1, NULL, '2021-06-17 09:15:14');

-- --------------------------------------------------------

--
-- Table structure for table `account_types`
--

CREATE TABLE `account_types` (
  `id` bigint(20) UNSIGNED NOT NULL,
  `name` varchar(255) COLLATE utf8mb4_unicode_ci NOT NULL,
  `remark` mediumtext COLLATE utf8mb4_unicode_ci DEFAULT NULL,
  `status` tinyint(1) NOT NULL DEFAULT 1,
  `created_at` timestamp NULL DEFAULT NULL,
  `updated_at` timestamp NULL DEFAULT NULL
) ENGINE=InnoDB DEFAULT CHARSET=utf8mb4 COLLATE=utf8mb4_unicode_ci;

--
-- Dumping data for table `account_types`
--

INSERT INTO `account_types` (`id`, `name`, `remark`, `status`, `created_at`, `updated_at`) VALUES
(2, 'Payment', 'This is payment type account', 1, NULL, '2021-05-05 06:04:04'),
(3, 'Dabit', 'This is dabit type.', 1, NULL, '2021-05-02 13:05:58');

-- --------------------------------------------------------

--
-- Table structure for table `admin_and_users`
--

CREATE TABLE `admin_and_users` (
  `id` bigint(20) UNSIGNED NOT NULL,
  `prefix` varchar(255) COLLATE utf8mb4_unicode_ci DEFAULT NULL,
  `name` varchar(255) COLLATE utf8mb4_unicode_ci NOT NULL,
  `last_name` varchar(255) COLLATE utf8mb4_unicode_ci DEFAULT NULL,
  `emp_id` varchar(50) COLLATE utf8mb4_unicode_ci DEFAULT NULL,
  `username` varchar(255) COLLATE utf8mb4_unicode_ci DEFAULT NULL,
  `email` varchar(255) COLLATE utf8mb4_unicode_ci NOT NULL,
  `shift_id` bigint(20) UNSIGNED DEFAULT NULL,
  `role_type` int(11) DEFAULT NULL COMMENT '1=super_admin,2=admin,3=others',
  `role_id` bigint(20) UNSIGNED DEFAULT NULL,
  `role_permission_id` bigint(20) UNSIGNED DEFAULT NULL,
  `allow_login` tinyint(1) NOT NULL DEFAULT 0,
  `branch_id` bigint(20) UNSIGNED DEFAULT NULL,
  `status` tinyint(1) NOT NULL DEFAULT 1,
  `password` varchar(255) COLLATE utf8mb4_unicode_ci DEFAULT NULL,
  `sales_commission_percent` decimal(8,2) NOT NULL DEFAULT 0.00,
  `max_sales_discount_percent` decimal(8,2) NOT NULL DEFAULT 0.00,
  `phone` varchar(255) COLLATE utf8mb4_unicode_ci DEFAULT NULL,
  `date_of_birth` varchar(255) COLLATE utf8mb4_unicode_ci DEFAULT NULL,
  `gender` varchar(255) COLLATE utf8mb4_unicode_ci DEFAULT NULL,
  `marital_status` varchar(255) COLLATE utf8mb4_unicode_ci DEFAULT NULL,
  `blood_group` varchar(255) COLLATE utf8mb4_unicode_ci DEFAULT NULL,
  `photo` varchar(255) COLLATE utf8mb4_unicode_ci NOT NULL DEFAULT 'default.png',
  `facebook_link` varchar(255) COLLATE utf8mb4_unicode_ci DEFAULT NULL,
  `twitter_link` varchar(255) COLLATE utf8mb4_unicode_ci DEFAULT NULL,
  `instagram_link` varchar(255) COLLATE utf8mb4_unicode_ci DEFAULT NULL,
  `social_media_1` varchar(255) COLLATE utf8mb4_unicode_ci DEFAULT NULL,
  `social_media_2` varchar(255) COLLATE utf8mb4_unicode_ci DEFAULT NULL,
  `custom_field_1` varchar(255) COLLATE utf8mb4_unicode_ci DEFAULT NULL,
  `custom_field_2` varchar(255) COLLATE utf8mb4_unicode_ci DEFAULT NULL,
  `guardian_name` varchar(255) COLLATE utf8mb4_unicode_ci DEFAULT NULL,
  `id_proof_name` varchar(255) COLLATE utf8mb4_unicode_ci DEFAULT NULL,
  `id_proof_number` varchar(255) COLLATE utf8mb4_unicode_ci DEFAULT NULL,
  `permanent_address` text COLLATE utf8mb4_unicode_ci DEFAULT NULL,
  `current_address` text COLLATE utf8mb4_unicode_ci DEFAULT NULL,
  `bank_ac_holder_name` varchar(255) COLLATE utf8mb4_unicode_ci DEFAULT NULL,
  `bank_ac_no` varchar(255) COLLATE utf8mb4_unicode_ci DEFAULT NULL,
  `bank_name` varchar(255) COLLATE utf8mb4_unicode_ci DEFAULT NULL,
  `bank_identifier_code` varchar(255) COLLATE utf8mb4_unicode_ci DEFAULT NULL,
  `bank_branch` varchar(255) COLLATE utf8mb4_unicode_ci DEFAULT NULL,
  `tax_payer_id` varchar(255) COLLATE utf8mb4_unicode_ci DEFAULT NULL,
  `language` varchar(255) COLLATE utf8mb4_unicode_ci DEFAULT NULL,
  `department_id` bigint(20) UNSIGNED DEFAULT NULL,
  `designation_id` bigint(20) UNSIGNED DEFAULT NULL,
  `salary` decimal(22,2) NOT NULL DEFAULT 0.00,
  `salary_type` varchar(191) COLLATE utf8mb4_unicode_ci DEFAULT NULL,
  `created_at` timestamp NULL DEFAULT NULL,
  `updated_at` timestamp NULL DEFAULT NULL
) ENGINE=InnoDB DEFAULT CHARSET=utf8mb4 COLLATE=utf8mb4_unicode_ci;

--
-- Dumping data for table `admin_and_users`
--

INSERT INTO `admin_and_users` (`id`, `prefix`, `name`, `last_name`, `emp_id`, `username`, `email`, `shift_id`, `role_type`, `role_id`, `role_permission_id`, `allow_login`, `branch_id`, `status`, `password`, `sales_commission_percent`, `max_sales_discount_percent`, `phone`, `date_of_birth`, `gender`, `marital_status`, `blood_group`, `photo`, `facebook_link`, `twitter_link`, `instagram_link`, `social_media_1`, `social_media_2`, `custom_field_1`, `custom_field_2`, `guardian_name`, `id_proof_name`, `id_proof_number`, `permanent_address`, `current_address`, `bank_ac_holder_name`, `bank_ac_no`, `bank_name`, `bank_identifier_code`, `bank_branch`, `tax_payer_id`, `language`, `department_id`, `designation_id`, `salary`, `salary_type`, `created_at`, `updated_at`) VALUES
(2, 'Mr', 'Super', 'Admin', NULL, 'superadmin', 'superadmin@gamil.com', NULL, 1, NULL, 8, 1, NULL, 1, '$2y$10$rd3uLXbr7OXtcZAh5VAj1u.nHtBpy0.gZx5HYXJ1uSR/TpT/nVBai', '0.00', '0.00', NULL, NULL, NULL, NULL, NULL, 'default.png', NULL, NULL, NULL, NULL, NULL, NULL, NULL, NULL, NULL, NULL, NULL, NULL, NULL, NULL, NULL, NULL, NULL, NULL, 'en', NULL, NULL, '0.00', NULL, '2021-04-07 07:04:03', '2021-05-25 08:29:27'),
(3, 'Mr', 'branch', 'manager', NULL, 'BranchC', 'branchb@gmail.com', NULL, 3, 10, 7, 1, 26, 1, '$2y$10$pdWTj/XaAYZH/a/qbUdYReLZLrFJHJzDVsNR5YoWtp0NATIspEIXa', '0.00', '0.00', NULL, NULL, NULL, NULL, NULL, 'default.png', NULL, NULL, NULL, NULL, NULL, NULL, NULL, NULL, NULL, NULL, NULL, NULL, NULL, NULL, NULL, NULL, NULL, NULL, NULL, 1, 1, '0.00', NULL, '2021-04-07 11:26:16', '2021-04-11 06:39:41'),
(4, 'Mr', 'single', 'shop', NULL, 'singleshop', 'ss@gmail.com', NULL, 2, NULL, 8, 1, NULL, 1, '$2y$10$XRuRIDrLRD64WE67ShGyiuK7Yq7/.Wn1c4uKUqRKJwDy22aQQ4yai', '0.00', '0.00', NULL, '18-04-2021', NULL, NULL, NULL, 'default.png', NULL, NULL, NULL, NULL, NULL, NULL, NULL, NULL, NULL, NULL, NULL, NULL, 'FF', 'FF', 'FF', 'FF', 'FF', 'FF', NULL, 2, 1, '0.00', NULL, '2021-04-18 11:16:36', '2021-04-18 11:16:36'),
(5, 'Mr', 'Employee', 'Man', NULL, 'employee', 'me@gmail.com', NULL, 3, 10, 7, 1, 25, 1, '$2y$10$fanNVJ/9DiCisq4wbwagTuVRDqRPu1J5ktGoM4BY4KKKfDAP1hcs.', '0.00', '0.00', NULL, '18-04-2021', NULL, NULL, NULL, 'default.png', NULL, NULL, NULL, NULL, NULL, NULL, NULL, NULL, NULL, NULL, NULL, NULL, NULL, NULL, NULL, NULL, NULL, NULL, NULL, 1, 1, '0.00', NULL, '2021-04-18 11:21:23', '2021-04-19 11:04:40'),
(6, 'Mr', 'Employee', 'Em', NULL, NULL, 'em@gmail.com', NULL, NULL, NULL, NULL, 0, NULL, 0, '$2y$10$vTRxd0/Q7SiexdFud9jB6.7EiJVciEVlf1GdkLFerfwjKsRr3xbjS', '20.00', '25.00', '0158997744', NULL, NULL, 'Married', NULL, 'default.png', NULL, NULL, NULL, NULL, NULL, NULL, NULL, NULL, NULL, NULL, NULL, NULL, 'FF', 'FF', 'FF', 'FF', 'FF', 'FF', NULL, 2, 1, '15000.00', 'Monthly', '2021-04-19 10:25:19', '2021-05-02 04:50:18'),
(7, 'MD.', 'Faisal', NULL, '107', 'faisal', 'faisal@gmail.com', 2, 3, 10, 7, 1, 24, 0, '$2y$10$6LP5AtoUXHbQ8E14cBUmX.Ruzv65H.0TL8nT.7nRaf1yrOFU0NHc.', '0.00', '0.00', NULL, NULL, 'Male', 'Unmarried', NULL, 'default.png', NULL, NULL, NULL, NULL, NULL, NULL, NULL, NULL, NULL, NULL, NULL, NULL, NULL, NULL, NULL, NULL, NULL, NULL, 'en', 2, 1, '0.00', 'Monthly', '2021-04-28 08:27:33', '2021-06-13 12:13:09'),
(9, 'Mr', 'Employee', '2', NULL, NULL, 'me2@gmail.com', NULL, NULL, NULL, NULL, 0, 24, 0, NULL, '20.00', '5.00', NULL, NULL, NULL, 'Unmarried', NULL, 'default.png', NULL, NULL, NULL, NULL, NULL, NULL, NULL, NULL, NULL, NULL, NULL, NULL, 'MR', '935787454', 'JANUNA', '6878787', 'Motijheel', '5687874554', NULL, 2, 1, '15000.00', 'Yearly', '2021-05-02 03:46:07', '2021-05-02 04:46:11'),
(10, 'Mr', 'Hamish', 'Khan', 'EP-125578', 'hamish', 'h@gmail.com', 2, 3, 16, 12, 1, 24, 0, '$2y$10$.PvlXGZwh4CyGBp6iqGIKuAa7Gu2Y7wFt2t.zfgkMahfUc1ZVh2Fi', '0.00', '0.00', NULL, NULL, NULL, NULL, NULL, 'default.png', NULL, NULL, NULL, NULL, NULL, NULL, NULL, NULL, NULL, NULL, NULL, NULL, NULL, NULL, NULL, NULL, NULL, NULL, NULL, 2, 1, '15000.00', 'Monthly', '2021-06-09 10:31:59', '2021-06-09 10:31:59');

-- --------------------------------------------------------

--
-- Table structure for table `allowance_employees`
--

CREATE TABLE `allowance_employees` (
  `id` bigint(20) UNSIGNED NOT NULL,
  `allowance_id` bigint(20) UNSIGNED DEFAULT NULL,
  `user_id` bigint(20) UNSIGNED DEFAULT NULL,
  `is_delete_in_update` tinyint(1) DEFAULT 0,
  `created_at` timestamp NULL DEFAULT NULL,
  `updated_at` timestamp NULL DEFAULT NULL
) ENGINE=InnoDB DEFAULT CHARSET=utf8mb4 COLLATE=utf8mb4_unicode_ci;

-- --------------------------------------------------------

--
-- Table structure for table `assets`
--

CREATE TABLE `assets` (
  `id` bigint(20) UNSIGNED NOT NULL,
  `asset_name` varchar(255) COLLATE utf8mb4_unicode_ci NOT NULL,
  `type_id` bigint(20) UNSIGNED DEFAULT NULL,
  `branch_id` bigint(20) UNSIGNED DEFAULT NULL,
  `quantity` decimal(22,2) NOT NULL DEFAULT 0.00,
  `per_unit_value` decimal(22,2) NOT NULL DEFAULT 0.00,
  `total_value` decimal(22,2) NOT NULL DEFAULT 0.00,
  `created_at` timestamp NULL DEFAULT NULL,
  `updated_at` timestamp NULL DEFAULT NULL
) ENGINE=InnoDB DEFAULT CHARSET=utf8mb4 COLLATE=utf8mb4_unicode_ci;

--
-- Dumping data for table `assets`
--

INSERT INTO `assets` (`id`, `asset_name`, `type_id`, `branch_id`, `quantity`, `per_unit_value`, `total_value`, `created_at`, `updated_at`) VALUES
(15, 'dd', 1, 24, '10.00', '10.00', '100.00', NULL, NULL),
(16, 'AC Gree', 6, 24, '2.00', '25000.00', '50000.00', NULL, NULL),
(17, 'Dell Brand Pc', 5, NULL, '6.00', '20000.00', '120000.00', NULL, NULL),
(18, 'Chair', 1, 25, '20.00', '300.00', '6000.00', NULL, NULL),
(19, 'Mouse', 4, 26, '8.00', '350.00', '2800.00', NULL, NULL),
(20, 'Monitor', 7, 24, '12.00', '8000.00', '96000.00', NULL, NULL),
(21, 'msi Monitor', 7, NULL, '2.00', '8500.00', '17000.00', NULL, NULL);

-- --------------------------------------------------------

--
-- Table structure for table `asset_types`
--

CREATE TABLE `asset_types` (
  `id` bigint(20) UNSIGNED NOT NULL,
  `asset_type_name` varchar(255) COLLATE utf8mb4_unicode_ci NOT NULL,
  `asset_type_code` varchar(255) COLLATE utf8mb4_unicode_ci DEFAULT NULL,
  `created_at` timestamp NULL DEFAULT NULL,
  `updated_at` timestamp NULL DEFAULT NULL
) ENGINE=InnoDB DEFAULT CHARSET=utf8mb4 COLLATE=utf8mb4_unicode_ci;

--
-- Dumping data for table `asset_types`
--

INSERT INTO `asset_types` (`id`, `asset_type_name`, `asset_type_code`, `created_at`, `updated_at`) VALUES
(1, 'Furniture', 'F12', NULL, NULL),
(4, 'Accessories', 'ACS-5', NULL, NULL),
(5, 'Computer', 'CMP-12', NULL, NULL),
(6, 'AC', 'AC-85', NULL, NULL),
(7, 'Electronics', 'ELC-105', NULL, '2021-06-16 05:23:37');

-- --------------------------------------------------------

--
-- Table structure for table `banks`
--

CREATE TABLE `banks` (
  `id` bigint(20) UNSIGNED NOT NULL,
  `name` varchar(255) COLLATE utf8mb4_unicode_ci NOT NULL,
  `branch_name` varchar(255) COLLATE utf8mb4_unicode_ci NOT NULL,
  `address` mediumtext COLLATE utf8mb4_unicode_ci DEFAULT NULL,
  `created_at` timestamp NULL DEFAULT NULL,
  `updated_at` timestamp NULL DEFAULT NULL
) ENGINE=InnoDB DEFAULT CHARSET=utf8mb4 COLLATE=utf8mb4_unicode_ci;

--
-- Dumping data for table `banks`
--

INSERT INTO `banks` (`id`, `name`, `branch_name`, `address`, `created_at`, `updated_at`) VALUES
(2, 'BRAC BANK', 'Mirpur-1', 'Dhaka, Bangladesh.', NULL, '2020-12-15 04:59:22'),
(6, 'RUPALI BANK', 'Mirpur - 1', 'Dhaka, Bangladesh.', NULL, '2020-12-15 04:59:08'),
(7, 'JAMUNA BANK', 'Matijheel', NULL, NULL, NULL);

-- --------------------------------------------------------

--
-- Table structure for table `barcode_settings`
--

CREATE TABLE `barcode_settings` (
  `id` bigint(20) UNSIGNED NOT NULL,
  `name` varchar(255) COLLATE utf8mb4_unicode_ci NOT NULL,
  `description` mediumtext COLLATE utf8mb4_unicode_ci DEFAULT NULL,
  `is_continuous` tinyint(1) NOT NULL DEFAULT 0,
  `top_margin` bigint(20) NOT NULL DEFAULT 0,
  `left_margin` bigint(20) NOT NULL DEFAULT 0,
  `sticker_width` bigint(20) NOT NULL DEFAULT 0,
  `sticker_height` bigint(20) NOT NULL DEFAULT 0,
  `paper_width` bigint(20) NOT NULL DEFAULT 0,
  `paper_height` bigint(20) NOT NULL DEFAULT 0,
  `row_distance` bigint(20) NOT NULL DEFAULT 0,
  `column_distance` bigint(20) NOT NULL DEFAULT 0,
  `stickers_in_a_row` bigint(20) NOT NULL DEFAULT 0,
  `stickers_in_one_sheet` bigint(20) NOT NULL DEFAULT 0,
  `is_default` tinyint(1) NOT NULL DEFAULT 0,
  `created_at` timestamp NULL DEFAULT NULL,
  `updated_at` timestamp NULL DEFAULT NULL
) ENGINE=InnoDB DEFAULT CHARSET=utf8mb4 COLLATE=utf8mb4_unicode_ci;

--
-- Dumping data for table `barcode_settings`
--

INSERT INTO `barcode_settings` (`id`, `name`, `description`, `is_continuous`, `top_margin`, `left_margin`, `sticker_width`, `sticker_height`, `paper_width`, `paper_height`, `row_distance`, `column_distance`, `stickers_in_a_row`, `stickers_in_one_sheet`, `is_default`, `created_at`, `updated_at`) VALUES
(1, 'Pearl Glover', 'Magnam fugiat aute', 0, 57, 98, 58, 68, 68, 98, 43, 61, 84, 99, 1, NULL, '2021-06-22 06:32:33');

-- --------------------------------------------------------

--
-- Table structure for table `branches`
--

CREATE TABLE `branches` (
  `id` bigint(20) UNSIGNED NOT NULL,
  `name` varchar(255) COLLATE utf8mb4_unicode_ci NOT NULL,
  `branch_code` varchar(255) COLLATE utf8mb4_unicode_ci DEFAULT NULL,
  `phone` varchar(255) COLLATE utf8mb4_unicode_ci DEFAULT NULL,
  `city` varchar(255) COLLATE utf8mb4_unicode_ci DEFAULT NULL,
  `state` varchar(255) COLLATE utf8mb4_unicode_ci DEFAULT NULL,
  `zip_code` varchar(255) COLLATE utf8mb4_unicode_ci DEFAULT NULL,
  `alternate_phone_number` varchar(255) COLLATE utf8mb4_unicode_ci DEFAULT NULL,
  `country` varchar(191) COLLATE utf8mb4_unicode_ci DEFAULT NULL,
  `email` varchar(255) COLLATE utf8mb4_unicode_ci DEFAULT NULL,
  `website` varchar(255) COLLATE utf8mb4_unicode_ci DEFAULT NULL,
  `logo` varchar(191) COLLATE utf8mb4_unicode_ci DEFAULT 'default.png',
  `invoice_schema_id` bigint(20) UNSIGNED DEFAULT NULL,
  `add_sale_invoice_layout_id` bigint(20) UNSIGNED DEFAULT NULL,
  `pos_sale_invoice_layout_id` bigint(20) UNSIGNED DEFAULT NULL,
  `default_account_id` bigint(20) UNSIGNED DEFAULT NULL,
  `purchase_permission` tinyint(1) NOT NULL DEFAULT 0,
  `after_purchase_store` tinyint(4) DEFAULT NULL COMMENT '1=branch;2=warehouse',
  `created_at` timestamp NULL DEFAULT NULL,
  `updated_at` timestamp NULL DEFAULT NULL
) ENGINE=InnoDB DEFAULT CHARSET=utf8mb4 COLLATE=utf8mb4_unicode_ci;

--
-- Dumping data for table `branches`
--

INSERT INTO `branches` (`id`, `name`, `branch_code`, `phone`, `city`, `state`, `zip_code`, `alternate_phone_number`, `country`, `email`, `website`, `logo`, `invoice_schema_id`, `add_sale_invoice_layout_id`, `pos_sale_invoice_layout_id`, `default_account_id`, `purchase_permission`, `after_purchase_store`, `created_at`, `updated_at`) VALUES
(24, 'SpeedDigit Computers', 'D122', '01792288555', 'Gawsia Kasem Center 10/2 Arambagh (7th floor)', 'Motijheel, Dhaka', '1000', NULL, 'Bangladesh', 'speeddigitinfo@gmail.com', NULL, '60891c09ddefb-.png', 3, 1, 1, NULL, 1, NULL, '2021-03-07 12:30:56', '2021-05-03 06:39:34'),
(25, 'Branch B', 'B1225', '0158799684', 'Dhaka', 'Dhaka', '458588', NULL, 'Bangladesh', 'b@gmail.com', 'https://branchB.com', '605efe866b64e-.png', 3, 1, 1, 15, 1, NULL, '2021-03-27 09:44:38', '2021-05-03 06:40:48'),
(26, 'Branch C', 'C12554', '0157896645', 'Dhaka', 'Dhaka', '788955', NULL, 'Bangladesh', 'c@gmail.com', NULL, '605efebfeeae8-.png', 3, 1, 1, 16, 1, NULL, '2021-03-27 09:45:35', '2021-04-12 12:47:09');

-- --------------------------------------------------------

--
-- Table structure for table `branch_payment_methods`
--

CREATE TABLE `branch_payment_methods` (
  `id` bigint(20) UNSIGNED NOT NULL,
  `branch_id` bigint(20) UNSIGNED NOT NULL,
  `method_name` varchar(255) COLLATE utf8mb4_unicode_ci NOT NULL,
  `account_id` bigint(20) UNSIGNED DEFAULT NULL,
  `is_delete_in_update` tinyint(1) NOT NULL DEFAULT 0,
  `created_at` timestamp NULL DEFAULT NULL,
  `updated_at` timestamp NULL DEFAULT NULL
) ENGINE=InnoDB DEFAULT CHARSET=utf8mb4 COLLATE=utf8mb4_unicode_ci;

-- --------------------------------------------------------

--
-- Table structure for table `brands`
--

CREATE TABLE `brands` (
  `id` bigint(20) UNSIGNED NOT NULL,
  `name` varchar(255) COLLATE utf8mb4_unicode_ci NOT NULL,
  `photo` varchar(255) COLLATE utf8mb4_unicode_ci NOT NULL DEFAULT 'default.png',
  `status` tinyint(1) NOT NULL DEFAULT 1,
  `created_at` timestamp NULL DEFAULT NULL,
  `updated_at` timestamp NULL DEFAULT NULL
) ENGINE=InnoDB DEFAULT CHARSET=utf8mb4 COLLATE=utf8mb4_unicode_ci;

--
-- Dumping data for table `brands`
--

INSERT INTO `brands` (`id`, `name`, `photo`, `status`, `created_at`, `updated_at`) VALUES
(5, 'Realme', '5fb214ee42d95.png', 1, NULL, NULL),
(6, 'Samsung', '5fb214f918f3c.png', 1, NULL, NULL),
(7, 'Transend Edited', '5fb215048a363.png', 1, NULL, '2020-11-15 23:59:01'),
(8, 'Asus', '5fb2150fbf4bb.jpg', 1, NULL, NULL),
(9, 'HP', '5fb2151a318c1.jpg', 1, NULL, NULL),
(10, 'Apple', '5fb379c0b4a2c.png', 1, NULL, NULL),
(11, 'Kama Sonic', 'default.png', 1, '2021-01-19 04:09:34', '2021-01-19 04:09:34'),
(12, 'Baby', 'default.png', 1, '2021-02-24 06:29:41', '2021-02-24 06:29:41'),
(14, 'Miako', 'default.png', 1, NULL, NULL),
(15, 'RealMax', 'default.png', 1, NULL, NULL),
(16, 'Lg', 'default.png', 1, NULL, '2021-04-20 10:22:23'),
(17, 'A4Tech', 'default.png', 1, '2021-04-28 05:19:14', '2021-04-28 05:19:14'),
(18, 'WD', 'default.png', 1, '2021-04-28 08:06:03', '2021-04-28 08:06:03'),
(19, 'Apacer', '6099fcc053834.png', 1, '2021-04-28 08:12:54', '2021-05-11 03:40:48'),
(20, 'Lenovo', '6099fcb14a6ff.png', 1, '2021-04-28 08:15:14', '2021-05-11 03:40:33'),
(21, 'Max Green', '6091000b367f9.png', 1, '2021-04-28 08:17:50', '2021-05-04 08:04:27'),
(25, 'Test Brand', 'default.png', 1, '2021-06-17 05:20:41', '2021-06-17 05:20:41'),
(26, 'Dell', 'default.png', 1, '2021-06-17 05:24:01', '2021-06-17 05:24:01');

-- --------------------------------------------------------

--
-- Table structure for table `bulk_variants`
--

CREATE TABLE `bulk_variants` (
  `id` bigint(20) UNSIGNED NOT NULL,
  `bulk_variant_name` varchar(255) COLLATE utf8mb4_unicode_ci NOT NULL,
  `created_at` timestamp NULL DEFAULT NULL,
  `updated_at` timestamp NULL DEFAULT NULL
) ENGINE=InnoDB DEFAULT CHARSET=utf8mb4 COLLATE=utf8mb4_unicode_ci;

--
-- Dumping data for table `bulk_variants`
--

INSERT INTO `bulk_variants` (`id`, `bulk_variant_name`, `created_at`, `updated_at`) VALUES
(7, 'Color', '2020-11-14 22:42:02', '2020-11-14 22:42:02'),
(8, 'Size', '2020-11-14 22:42:53', '2020-11-14 22:42:53'),
(9, 'Ram', '2020-11-14 22:44:33', '2020-11-14 22:44:33'),
(10, 'Storage', '2020-11-14 22:45:30', '2020-11-14 22:45:30'),
(12, 'Qualities', '2020-11-24 03:17:09', '2020-11-24 03:17:09'),
(13, 'Kilogram', '2020-12-30 03:08:35', '2020-12-30 03:08:35');

-- --------------------------------------------------------

--
-- Table structure for table `bulk_variant_children`
--

CREATE TABLE `bulk_variant_children` (
  `id` bigint(20) UNSIGNED NOT NULL,
  `bulk_variant_id` bigint(20) UNSIGNED DEFAULT NULL,
  `child_name` varchar(191) COLLATE utf8mb4_unicode_ci DEFAULT NULL,
  `delete_in_update` tinyint(1) NOT NULL DEFAULT 0,
  `created_at` timestamp NULL DEFAULT NULL,
  `updated_at` timestamp NULL DEFAULT NULL
) ENGINE=InnoDB DEFAULT CHARSET=utf8mb4 COLLATE=utf8mb4_unicode_ci;

--
-- Dumping data for table `bulk_variant_children`
--

INSERT INTO `bulk_variant_children` (`id`, `bulk_variant_id`, `child_name`, `delete_in_update`, `created_at`, `updated_at`) VALUES
(18, 7, 'Red', 0, '2020-11-14 22:42:02', '2021-04-28 12:17:20'),
(19, 7, 'Green', 0, '2020-11-14 22:42:02', '2021-04-28 12:17:20'),
(20, 7, 'Blue', 0, '2020-11-14 22:42:02', '2021-04-28 12:17:20'),
(21, 7, 'Black', 0, '2020-11-14 22:42:02', '2021-04-28 12:17:20'),
(24, 8, 'M', 0, '2020-11-14 22:42:53', '2021-02-22 06:06:06'),
(25, 8, 'L', 0, '2020-11-14 22:42:53', '2021-02-22 06:06:06'),
(26, 8, 'XL', 0, '2020-11-14 22:42:53', '2021-02-22 06:06:06'),
(27, 8, 'XXL', 0, '2020-11-14 22:42:53', '2021-02-22 06:06:06'),
(28, 9, '2GB', 0, '2020-11-14 22:44:33', '2021-04-28 12:17:23'),
(29, 9, '3GB', 0, '2020-11-14 22:44:33', '2021-04-28 12:17:23'),
(30, 9, '4GB', 0, '2020-11-14 22:44:33', '2021-04-28 12:17:23'),
(31, 9, '6GB', 0, '2020-11-14 22:44:33', '2021-04-28 12:17:23'),
(32, 9, '8GB', 0, '2020-11-14 22:44:33', '2021-04-28 12:17:23'),
(33, 9, '12GB', 0, '2020-11-14 22:44:33', '2021-04-28 12:17:23'),
(34, 10, '16GB', 0, '2020-11-14 22:45:30', '2021-04-21 04:16:53'),
(35, 10, '32GB', 0, '2020-11-14 22:45:30', '2021-04-21 04:16:53'),
(36, 10, '64GB', 0, '2020-11-14 22:45:30', '2021-04-21 04:16:53'),
(37, 10, '128GB', 0, '2020-11-14 22:45:30', '2021-04-21 04:16:53'),
(38, 10, '256GB', 0, '2020-11-14 22:45:30', '2021-04-21 04:16:53'),
(45, 12, 'Q-1', 0, '2020-11-24 03:17:09', '2021-04-21 04:18:05'),
(46, 12, 'Q-2', 0, '2020-11-24 03:17:09', '2021-04-21 04:18:05'),
(47, 12, 'Q-3', 0, '2020-11-24 03:17:09', '2021-04-21 04:18:05'),
(48, 12, 'Q-4', 0, '2020-11-24 03:17:09', '2021-04-21 04:18:05'),
(51, 13, '250Gram', 0, '2020-12-30 03:08:35', '2021-04-28 12:17:27'),
(52, 13, '500Gram', 0, '2020-12-30 03:08:35', '2021-04-28 12:17:27'),
(53, 13, '1000Gram', 0, '2020-12-30 03:08:35', '2021-04-28 12:17:27'),
(54, 13, '2KG', 0, '2020-12-30 03:08:35', '2021-04-28 12:17:27'),
(55, 13, '750Gram', 0, '2020-12-30 03:08:35', '2021-04-28 12:17:27'),
(56, 10, '512GB', 0, '2021-02-08 10:26:16', '2021-04-21 04:16:53');

-- --------------------------------------------------------

--
-- Table structure for table `card_types`
--

CREATE TABLE `card_types` (
  `id` bigint(20) UNSIGNED NOT NULL,
  `card_type_name` varchar(255) COLLATE utf8mb4_unicode_ci NOT NULL,
  `account_id` bigint(20) UNSIGNED DEFAULT NULL,
  `created_at` timestamp NULL DEFAULT NULL,
  `updated_at` timestamp NULL DEFAULT NULL
) ENGINE=InnoDB DEFAULT CHARSET=utf8mb4 COLLATE=utf8mb4_unicode_ci;

--
-- Dumping data for table `card_types`
--

INSERT INTO `card_types` (`id`, `card_type_name`, `account_id`, `created_at`, `updated_at`) VALUES
(4, 'Master Card', 15, NULL, NULL),
(5, 'ATM Card', 16, NULL, '2021-06-17 11:57:02'),
(6, 'Pioneer Card', 15, NULL, NULL),
(7, 'Visa Card', 15, NULL, NULL),
(8, 'Debit Card', 16, NULL, NULL),
(9, 'Credit Card', 15, NULL, NULL);

-- --------------------------------------------------------

--
-- Table structure for table `cash_counters`
--

CREATE TABLE `cash_counters` (
  `id` bigint(20) UNSIGNED NOT NULL,
  `counter_name` varchar(255) COLLATE utf8mb4_unicode_ci NOT NULL,
  `short_name` varchar(255) COLLATE utf8mb4_unicode_ci NOT NULL,
  `created_at` timestamp NULL DEFAULT NULL,
  `updated_at` timestamp NULL DEFAULT NULL
) ENGINE=InnoDB DEFAULT CHARSET=utf8mb4 COLLATE=utf8mb4_unicode_ci;

--
-- Dumping data for table `cash_counters`
--

INSERT INTO `cash_counters` (`id`, `counter_name`, `short_name`, `created_at`, `updated_at`) VALUES
(2, 'Cash Counter No 1', 'CCNO-1', NULL, NULL),
(3, 'Cash Counter No 2', 'CCNO-2', NULL, NULL);

-- --------------------------------------------------------

--
-- Table structure for table `cash_flows`
--

CREATE TABLE `cash_flows` (
  `id` bigint(20) UNSIGNED NOT NULL,
  `account_id` bigint(20) UNSIGNED NOT NULL,
  `sender_account_id` bigint(20) UNSIGNED DEFAULT NULL,
  `receiver_account_id` bigint(20) UNSIGNED DEFAULT NULL,
  `purchase_payment_id` bigint(20) UNSIGNED DEFAULT NULL,
  `sale_payment_id` bigint(20) UNSIGNED DEFAULT NULL,
  `expanse_payment_id` bigint(20) UNSIGNED DEFAULT NULL,
  `money_receipt_id` bigint(20) UNSIGNED DEFAULT NULL,
  `payroll_id` bigint(20) UNSIGNED DEFAULT NULL,
  `payroll_payment_id` bigint(20) UNSIGNED DEFAULT NULL,
  `debit` decimal(22,2) DEFAULT NULL,
  `credit` decimal(22,2) DEFAULT NULL,
  `balance` decimal(22,2) NOT NULL DEFAULT 0.00,
  `transaction_type` tinyint(4) NOT NULL COMMENT '1=payment;2=sale_payment;3=purchase_payment;4=fundTransfer;5=deposit;6=expansePayment;7=openingBalance;8=payroll_payment;9=money_receipt',
  `cash_type` tinyint(4) DEFAULT NULL COMMENT '1=debit;2=credit;',
  `date` varchar(255) COLLATE utf8mb4_unicode_ci NOT NULL,
  `month` varchar(255) COLLATE utf8mb4_unicode_ci NOT NULL,
  `year` varchar(255) COLLATE utf8mb4_unicode_ci NOT NULL,
  `report_date` timestamp NOT NULL DEFAULT current_timestamp() ON UPDATE current_timestamp(),
  `admin_id` bigint(20) UNSIGNED DEFAULT NULL,
  `related_cash_flow_id` bigint(20) UNSIGNED DEFAULT NULL,
  `created_at` timestamp NULL DEFAULT NULL,
  `updated_at` timestamp NULL DEFAULT NULL
) ENGINE=InnoDB DEFAULT CHARSET=utf8mb4 COLLATE=utf8mb4_unicode_ci;

--
-- Dumping data for table `cash_flows`
--

INSERT INTO `cash_flows` (`id`, `account_id`, `sender_account_id`, `receiver_account_id`, `purchase_payment_id`, `sale_payment_id`, `expanse_payment_id`, `money_receipt_id`, `payroll_id`, `payroll_payment_id`, `debit`, `credit`, `balance`, `transaction_type`, `cash_type`, `date`, `month`, `year`, `report_date`, `admin_id`, `related_cash_flow_id`, `created_at`, `updated_at`) VALUES
(4, 16, NULL, NULL, NULL, 4, NULL, NULL, NULL, NULL, NULL, '13348.75', '13957.00', 2, 2, '11-04-2021', 'April', '2021', '2021-04-10 18:00:00', 3, NULL, '2021-04-11 06:20:36', '2021-04-11 06:20:36'),
(5, 16, NULL, NULL, NULL, 6, NULL, NULL, NULL, NULL, NULL, '1805.00', '15762.00', 2, 2, '11-04-2021', 'April', '2021', '2021-04-10 18:00:00', 3, NULL, '2021-04-11 07:15:58', '2021-04-11 07:15:58'),
(6, 16, NULL, NULL, 102, NULL, NULL, NULL, NULL, NULL, '730.00', NULL, '15032.00', 3, 1, '13-04-2021', 'April', '2021', '2021-04-12 18:00:00', 3, NULL, '2021-04-13 06:16:42', '2021-04-13 06:16:42'),
(7, 16, NULL, NULL, NULL, 9, NULL, NULL, NULL, NULL, NULL, '1023.75', '16055.75', 2, 2, '17-04-2021', 'April', '2021', '2021-04-16 18:00:00', 2, NULL, '2021-04-17 03:47:27', '2021-04-17 03:47:27'),
(9, 15, NULL, NULL, NULL, NULL, NULL, 37, NULL, NULL, NULL, '500.00', '21675.00', 9, 2, '19-04-2021', 'April', '2021', '2021-04-18 18:00:00', 2, NULL, '2021-04-19 04:21:08', '2021-04-19 04:21:08'),
(10, 15, NULL, NULL, NULL, NULL, NULL, 40, NULL, NULL, NULL, '200.00', '21675.00', 9, 2, '19-04-2021', 'April', '2021', '2021-04-18 18:00:00', 2, NULL, '2021-04-19 05:07:19', '2021-04-19 05:07:19'),
(13, 15, NULL, NULL, NULL, 15, NULL, NULL, NULL, NULL, NULL, '315.00', '22620.00', 2, 2, '19-04-2021', 'April', '2021', '2021-04-18 18:00:00', 2, NULL, '2021-04-19 05:10:18', '2021-04-19 05:10:18'),
(15, 15, NULL, NULL, NULL, NULL, NULL, 41, NULL, NULL, NULL, '630.00', '23565.00', 9, 2, '19-04-2021', 'April', '2021', '2021-04-18 18:00:00', 2, NULL, '2021-04-19 05:10:18', '2021-04-19 05:10:18'),
(16, 15, NULL, NULL, NULL, NULL, NULL, 42, NULL, NULL, NULL, '400.00', '23415.00', 9, 2, '19-04-2021', 'April', '2021', '2021-04-18 18:00:00', 2, NULL, '2021-04-19 05:25:22', '2021-04-19 05:25:22'),
(17, 16, NULL, NULL, NULL, NULL, NULL, 43, NULL, NULL, NULL, '50.00', '16703.25', 9, 2, '19-04-2021', 'April', '2021', '2021-04-18 18:00:00', 2, NULL, '2021-04-19 05:34:12', '2021-04-19 05:34:12'),
(18, 16, NULL, NULL, NULL, NULL, NULL, 43, NULL, NULL, NULL, '150.00', '16853.25', 9, 2, '19-04-2021', 'April', '2021', '2021-04-18 18:00:00', 2, NULL, '2021-04-19 05:34:12', '2021-04-19 05:34:12'),
(20, 15, NULL, NULL, 104, NULL, NULL, NULL, NULL, NULL, '1150.00', NULL, '21115.00', 3, 1, '2021-04-21', 'April', '2021', '2021-04-20 18:00:00', 2, NULL, '2021-04-22 06:25:37', '2021-04-22 06:26:04'),
(21, 16, NULL, NULL, 111, NULL, NULL, NULL, NULL, NULL, '1150.00', NULL, '15703.25', 3, 1, '2021-04-22', 'April', '2021', '2021-04-21 18:00:00', 2, NULL, '2021-04-22 06:43:25', '2021-04-22 06:43:25'),
(22, 16, NULL, NULL, 112, NULL, NULL, NULL, NULL, NULL, '20.00', NULL, '15683.25', 3, 1, '2021-04-22', 'April', '2021', '2021-04-21 18:00:00', 2, NULL, '2021-04-22 07:15:00', '2021-04-22 07:15:00'),
(23, 16, NULL, NULL, 116, NULL, NULL, NULL, NULL, NULL, '315.00', NULL, '15368.25', 3, 1, '2021-04-24', 'April', '2021', '2021-04-23 18:00:00', 2, NULL, '2021-04-24 09:46:30', '2021-04-24 09:46:30'),
(24, 16, NULL, NULL, 119, NULL, NULL, NULL, NULL, NULL, '210.00', NULL, '15158.25', 3, 1, '2021-04-25', 'April', '2021', '2021-04-24 18:00:00', 3, NULL, '2021-04-25 07:40:51', '2021-04-25 07:40:51'),
(25, 16, NULL, NULL, NULL, 17, NULL, NULL, NULL, NULL, NULL, '2566.25', '17724.50', 2, 2, '25-04-2021', 'April', '2021', '2021-04-24 18:00:00', 3, NULL, '2021-04-25 11:46:06', '2021-04-25 11:46:06'),
(26, 16, NULL, NULL, NULL, 18, NULL, NULL, NULL, NULL, NULL, '1411.25', '19135.75', 2, 2, '25-04-2021', 'April', '2021', '2021-04-24 18:00:00', 3, NULL, '2021-04-25 11:56:13', '2021-04-25 11:56:13'),
(29, 15, NULL, NULL, NULL, 22, NULL, NULL, NULL, NULL, NULL, '1173.75', '23438.75', 2, 2, '25-04-2021', 'April', '2021', '2021-04-24 18:00:00', 2, NULL, '2021-04-25 13:43:29', '2021-04-25 13:43:29'),
(30, 16, NULL, NULL, NULL, 38, NULL, NULL, NULL, NULL, NULL, '180.06', '19315.81', 2, 2, '26-04-2021', 'April', '2021', '2021-04-25 18:00:00', 2, NULL, '2021-04-26 10:48:17', '2021-04-26 10:48:17'),
(36, 16, NULL, 15, NULL, NULL, NULL, NULL, NULL, NULL, '10.00', NULL, '19205.81', 4, 1, '2021-05-01', 'May', '2021', '2021-05-01 05:08:02', 2, 37, '2021-05-01 05:08:02', '2021-05-01 05:08:02'),
(37, 15, 16, NULL, NULL, NULL, NULL, NULL, NULL, NULL, NULL, '10.00', '21773.75', 4, 2, '2021-05-01', 'May', '2021', '2021-04-30 18:00:00', 2, 36, '2021-05-01 05:08:02', '2021-05-01 05:08:02'),
(38, 16, NULL, 15, NULL, NULL, NULL, NULL, NULL, NULL, '20.00', NULL, '19185.81', 4, 1, '2021-05-01', 'May', '2021', '2021-05-01 05:08:20', 2, 39, '2021-05-01 05:08:20', '2021-05-01 05:08:20'),
(39, 15, 16, NULL, NULL, NULL, NULL, NULL, NULL, NULL, NULL, '20.00', '21793.75', 4, 2, '2021-05-01', 'May', '2021', '2021-04-30 18:00:00', 2, 38, '2021-05-01 05:08:20', '2021-05-01 05:08:20'),
(40, 16, NULL, NULL, NULL, NULL, NULL, NULL, NULL, NULL, NULL, '10.00', '19195.81', 5, 2, '2021-05-01', 'May', '2021', '2021-04-30 18:00:00', 2, NULL, '2021-05-01 05:13:55', '2021-05-01 05:13:55'),
(41, 16, NULL, NULL, NULL, NULL, NULL, NULL, NULL, NULL, NULL, '20.00', '19215.81', 5, 2, '2021-05-01', 'May', '2021', '2021-04-30 18:00:00', 2, NULL, '2021-05-01 05:14:02', '2021-05-01 05:14:02'),
(42, 16, NULL, NULL, NULL, NULL, NULL, NULL, NULL, NULL, NULL, '20.00', '19235.81', 5, 2, '2021-05-01', 'May', '2021', '2021-04-30 18:00:00', 2, NULL, '2021-05-01 05:14:10', '2021-05-01 05:14:10'),
(43, 16, NULL, 15, NULL, NULL, NULL, NULL, NULL, NULL, '0.00', NULL, '19235.81', 4, 1, '2021-05-01', 'May', '2021', '2021-05-01 05:33:11', 2, 44, '2021-05-01 05:33:11', '2021-05-01 05:33:11'),
(44, 15, 16, NULL, NULL, NULL, NULL, NULL, NULL, NULL, NULL, '0.00', '21793.75', 4, 2, '2021-05-01', 'May', '2021', '2021-04-30 18:00:00', 2, 43, '2021-05-01 05:33:11', '2021-05-01 05:33:11'),
(49, 16, NULL, NULL, NULL, 41, NULL, NULL, NULL, NULL, NULL, '162.50', '19398.31', 2, 2, '2021-05-02', 'May', '2021', '2021-05-01 18:00:00', 2, NULL, '2021-05-02 10:44:58', '2021-05-02 10:44:58'),
(51, 16, NULL, NULL, 124, NULL, NULL, NULL, NULL, NULL, '9500.00', NULL, '2498.31', 3, 1, '2021-05-04', 'May', '2021', '2021-05-03 18:00:00', 2, NULL, '2021-05-04 03:58:13', '2021-05-04 03:58:13'),
(52, 15, NULL, NULL, NULL, 49, NULL, NULL, NULL, NULL, NULL, '1023.75', '22712.50', 2, 2, '08-05-2021', 'May', '2021', '2021-05-07 18:00:00', 2, NULL, '2021-05-08 12:44:59', '2021-05-08 12:44:59'),
(53, 15, NULL, NULL, NULL, 50, NULL, NULL, NULL, NULL, NULL, '300.00', '23012.50', 2, 2, '08-05-2021', 'May', '2021', '2021-05-07 18:00:00', 2, NULL, '2021-05-08 12:45:49', '2021-05-08 12:45:49'),
(54, 16, NULL, NULL, NULL, 58, NULL, NULL, NULL, NULL, NULL, '262.50', '2760.81', 2, 2, '08-05-2021', 'May', '2021', '2021-05-07 18:00:00', 2, NULL, '2021-05-08 13:07:54', '2021-05-08 13:07:54'),
(55, 16, NULL, NULL, NULL, 59, NULL, NULL, NULL, NULL, NULL, '262.50', '3023.31', 2, 2, '08-05-2021', 'May', '2021', '2021-05-07 18:00:00', 2, NULL, '2021-05-08 13:10:35', '2021-05-08 13:10:35'),
(56, 16, NULL, NULL, NULL, 60, NULL, NULL, NULL, NULL, NULL, '65.63', '3088.94', 2, 2, '08-05-2021', 'May', '2021', '2021-05-07 18:00:00', 2, NULL, '2021-05-08 13:11:24', '2021-05-08 13:11:24'),
(57, 16, NULL, NULL, NULL, 64, NULL, NULL, NULL, NULL, NULL, '262.50', '3351.44', 2, 2, '08-05-2021', 'May', '2021', '2021-05-07 18:00:00', 2, NULL, '2021-05-08 13:16:33', '2021-05-08 13:16:33'),
(58, 16, NULL, NULL, NULL, 66, NULL, NULL, NULL, NULL, NULL, '262.50', '3613.94', 2, 2, '08-05-2021', 'May', '2021', '2021-05-07 18:00:00', 2, NULL, '2021-05-08 13:18:34', '2021-05-08 13:18:34'),
(60, 16, NULL, NULL, NULL, 77, NULL, NULL, NULL, NULL, NULL, '262.50', '4138.94', 2, 2, '08-05-2021', 'May', '2021', '2021-05-07 18:00:00', 2, NULL, '2021-05-08 13:45:53', '2021-05-08 13:45:53'),
(61, 16, NULL, NULL, NULL, 78, NULL, NULL, NULL, NULL, NULL, '150.63', '4289.57', 2, 2, '08-05-2021', 'May', '2021', '2021-05-07 18:00:00', 2, NULL, '2021-05-08 13:45:53', '2021-05-08 13:45:53'),
(62, 16, NULL, NULL, NULL, 79, NULL, NULL, NULL, NULL, NULL, '262.50', '4552.07', 2, 2, '08-05-2021', 'May', '2021', '2021-05-07 18:00:00', 2, NULL, '2021-05-08 13:45:53', '2021-05-08 13:45:53'),
(63, 16, NULL, NULL, NULL, 80, NULL, NULL, NULL, NULL, NULL, '262.50', '4814.57', 2, 2, '08-05-2021', 'May', '2021', '2021-05-07 18:00:00', 2, NULL, '2021-05-08 13:45:53', '2021-05-08 13:45:53'),
(64, 16, NULL, NULL, NULL, 82, NULL, NULL, NULL, NULL, NULL, '254.63', '5069.20', 2, 2, '09-05-2021', 'May', '2021', '2021-05-08 18:00:00', 2, NULL, '2021-05-09 12:32:55', '2021-05-09 12:32:55'),
(68, 16, NULL, NULL, NULL, 109, NULL, NULL, NULL, NULL, NULL, '262.50', '5594.20', 2, 2, '10-05-2021', 'May', '2021', '2021-05-09 18:00:00', 2, NULL, '2021-05-10 05:23:23', '2021-05-10 05:23:23'),
(69, 16, NULL, NULL, NULL, 113, NULL, NULL, NULL, NULL, NULL, '262.50', '5594.20', 2, 2, '10-05-2021', 'May', '2021', '2021-05-09 18:00:00', 2, NULL, '2021-05-10 13:06:22', '2021-05-10 13:06:22'),
(71, 15, NULL, NULL, NULL, 121, NULL, NULL, NULL, NULL, NULL, '100.00', '23112.50', 2, 2, '18-05-2021', 'May', '2021', '2021-05-17 18:00:00', 2, NULL, '2021-05-18 07:26:26', '2021-05-18 07:26:26'),
(72, 15, NULL, NULL, NULL, 122, NULL, NULL, NULL, NULL, NULL, '100.00', '23212.50', 2, 2, '18-05-2021', 'May', '2021', '2021-05-17 18:00:00', 2, NULL, '2021-05-18 07:32:40', '2021-05-18 07:32:40'),
(73, 15, NULL, NULL, NULL, 123, NULL, NULL, NULL, NULL, NULL, '10.00', '23222.50', 2, 2, '18-05-2021', 'May', '2021', '2021-05-17 18:00:00', 2, NULL, '2021-05-18 09:28:34', '2021-05-18 09:28:34'),
(74, 15, NULL, NULL, NULL, 124, NULL, NULL, NULL, NULL, NULL, '1200.00', '24422.50', 2, 2, '18-05-2021', 'May', '2021', '2021-05-17 18:00:00', 2, NULL, '2021-05-18 13:23:04', '2021-05-18 13:23:04'),
(75, 15, NULL, NULL, NULL, 125, NULL, NULL, NULL, NULL, NULL, '1023.75', '25446.25', 2, 2, '18-05-2021', 'May', '2021', '2021-05-17 18:00:00', 2, NULL, '2021-05-18 13:30:41', '2021-05-18 13:30:41'),
(80, 15, NULL, NULL, NULL, 131, NULL, NULL, NULL, NULL, NULL, '400.00', '55351.75', 2, 2, '19-05-2021', 'May', '2021', '2021-05-18 18:00:00', 2, NULL, '2021-05-19 05:02:33', '2021-05-19 05:02:33'),
(81, 16, NULL, NULL, NULL, NULL, 31, NULL, NULL, NULL, '100.00', NULL, '5494.20', 6, 1, '2021-05-23', 'May', '2021', '2021-05-22 18:00:00', 2, NULL, '2021-05-23 11:27:15', '2021-05-23 11:27:15'),
(82, 15, NULL, NULL, NULL, 138, NULL, NULL, NULL, NULL, NULL, '262.50', '55614.25', 2, 2, '23-05-2021', 'May', '2021', '2021-05-22 18:00:00', 2, NULL, '2021-05-23 12:21:53', '2021-05-23 12:21:53'),
(83, 16, NULL, NULL, NULL, NULL, 32, NULL, NULL, NULL, '57.00', NULL, '5437.20', 6, 1, '2021-05-24', 'May', '2021', '2021-05-23 18:00:00', 7, NULL, '2021-05-24 04:49:47', '2021-05-24 04:49:47'),
(84, 15, NULL, NULL, NULL, NULL, 33, NULL, NULL, NULL, '15.00', NULL, '55599.25', 6, 1, '2021-05-24', 'May', '2021', '2021-05-23 18:00:00', 7, NULL, '2021-05-24 05:07:13', '2021-05-24 05:07:25'),
(85, 15, NULL, NULL, NULL, NULL, 34, NULL, NULL, NULL, '46.00', NULL, '55553.25', 6, 1, '2021-05-24', 'May', '2021', '2021-05-23 18:00:00', 7, NULL, '2021-05-24 05:07:37', '2021-05-24 05:07:37'),
(87, 15, NULL, NULL, NULL, 144, NULL, NULL, NULL, NULL, NULL, '742.50', '43295.75', 2, 2, '03-06-2021', 'June', '2021', '2021-06-02 18:00:00', 2, NULL, '2021-06-03 07:32:38', '2021-06-03 07:32:38'),
(88, 15, NULL, NULL, NULL, 145, NULL, NULL, NULL, NULL, NULL, '262.50', '43558.25', 2, 2, '03-06-2021', 'June', '2021', '2021-06-02 18:00:00', 2, NULL, '2021-06-03 07:51:44', '2021-06-03 07:51:44'),
(89, 15, NULL, NULL, NULL, 146, NULL, NULL, NULL, NULL, NULL, '886.25', '44444.50', 2, 2, '03-06-2021', 'June', '2021', '2021-06-02 18:00:00', 2, NULL, '2021-06-03 07:55:22', '2021-06-03 07:55:22'),
(90, 15, NULL, NULL, NULL, 147, NULL, NULL, NULL, NULL, NULL, '162.50', '44607.00', 2, 2, '03-06-2021', 'June', '2021', '2021-06-02 18:00:00', 2, NULL, '2021-06-03 08:00:48', '2021-06-03 08:00:48'),
(91, 15, NULL, NULL, NULL, 148, NULL, NULL, NULL, NULL, NULL, '262.50', '44869.50', 2, 2, '03-06-2021', 'June', '2021', '2021-06-02 18:00:00', 2, NULL, '2021-06-03 12:36:12', '2021-06-03 12:36:12'),
(92, 15, NULL, NULL, NULL, 149, NULL, NULL, NULL, NULL, NULL, '125.00', '44994.50', 2, 2, '03-06-2021', 'June', '2021', '2021-06-02 18:00:00', 2, NULL, '2021-06-03 12:49:39', '2021-06-03 12:49:39'),
(93, 15, NULL, NULL, NULL, 150, NULL, NULL, NULL, NULL, NULL, '262.50', '45257.00', 2, 2, '03-06-2021', 'June', '2021', '2021-06-02 18:00:00', 2, NULL, '2021-06-03 12:57:26', '2021-06-03 12:57:26'),
(94, 15, NULL, NULL, NULL, 151, NULL, NULL, NULL, NULL, NULL, '125.00', '45382.00', 2, 2, '03-06-2021', 'June', '2021', '2021-06-02 18:00:00', 2, NULL, '2021-06-03 13:03:27', '2021-06-03 13:03:27'),
(95, 15, NULL, NULL, NULL, 152, NULL, NULL, NULL, NULL, NULL, '886.25', '46268.25', 2, 2, '03-06-2021', 'June', '2021', '2021-06-02 18:00:00', 2, NULL, '2021-06-03 13:10:38', '2021-06-03 13:10:38'),
(96, 15, NULL, NULL, NULL, 153, NULL, NULL, NULL, NULL, NULL, '262.50', '46530.75', 2, 2, '03-06-2021', 'June', '2021', '2021-06-02 18:00:00', 2, NULL, '2021-06-03 13:11:16', '2021-06-03 13:11:16'),
(97, 15, NULL, NULL, NULL, 154, NULL, NULL, NULL, NULL, NULL, '761.25', '47292.00', 2, 2, '03-06-2021', 'June', '2021', '2021-06-02 18:00:00', 2, NULL, '2021-06-03 13:12:29', '2021-06-03 13:12:29'),
(98, 15, NULL, NULL, NULL, 155, NULL, NULL, NULL, NULL, NULL, '107.50', '47399.50', 2, 2, '03-06-2021', 'June', '2021', '2021-06-02 18:00:00', 2, NULL, '2021-06-03 13:14:09', '2021-06-03 13:14:09'),
(99, 15, NULL, NULL, NULL, 156, NULL, NULL, NULL, NULL, NULL, '262.50', '47662.00', 2, 2, '03-06-2021', 'June', '2021', '2021-06-02 18:00:00', 2, NULL, '2021-06-03 13:21:23', '2021-06-03 13:21:23'),
(100, 15, NULL, NULL, NULL, 157, NULL, NULL, NULL, NULL, NULL, '118.75', '47780.75', 2, 2, '03-06-2021', 'June', '2021', '2021-06-02 18:00:00', 2, NULL, '2021-06-03 13:22:00', '2021-06-03 13:22:00'),
(101, 15, NULL, NULL, NULL, 158, NULL, NULL, NULL, NULL, NULL, '250.00', '48030.75', 2, 2, '03-06-2021', 'June', '2021', '2021-06-02 18:00:00', 2, NULL, '2021-06-03 13:24:06', '2021-06-03 13:24:06'),
(102, 15, NULL, NULL, NULL, 159, NULL, NULL, NULL, NULL, NULL, '250.00', '48280.75', 2, 2, '03-06-2021', 'June', '2021', '2021-06-02 18:00:00', 2, NULL, '2021-06-03 13:25:26', '2021-06-03 13:25:26'),
(103, 15, NULL, NULL, NULL, 160, NULL, NULL, NULL, NULL, NULL, '6.25', '48287.00', 2, 2, '03-06-2021', 'June', '2021', '2021-06-02 18:00:00', 2, NULL, '2021-06-03 13:26:04', '2021-06-03 13:26:04'),
(104, 15, NULL, NULL, NULL, 161, NULL, NULL, NULL, NULL, NULL, '6.25', '48293.25', 2, 2, '03-06-2021', 'June', '2021', '2021-06-02 18:00:00', 2, NULL, '2021-06-03 13:26:45', '2021-06-03 13:26:45'),
(105, 15, NULL, NULL, NULL, 162, NULL, NULL, NULL, NULL, NULL, '887.50', '49180.75', 2, 2, '03-06-2021', 'June', '2021', '2021-06-02 18:00:00', 2, NULL, '2021-06-03 13:28:35', '2021-06-03 13:28:35'),
(106, 15, NULL, NULL, NULL, 163, NULL, NULL, NULL, NULL, NULL, '12.50', '49193.25', 2, 2, '03-06-2021', 'June', '2021', '2021-06-02 18:00:00', 2, NULL, '2021-06-03 13:29:07', '2021-06-03 13:29:07'),
(107, 15, NULL, NULL, NULL, 164, NULL, NULL, NULL, NULL, NULL, '25.00', '49218.25', 2, 2, '03-06-2021', 'June', '2021', '2021-06-02 18:00:00', 2, NULL, '2021-06-03 13:30:09', '2021-06-03 13:30:09'),
(108, 15, NULL, NULL, NULL, 165, NULL, NULL, NULL, NULL, NULL, '262.50', '49480.75', 2, 2, '03-06-2021', 'June', '2021', '2021-06-02 18:00:00', 2, NULL, '2021-06-03 13:31:57', '2021-06-03 13:31:57'),
(109, 15, NULL, NULL, NULL, 166, NULL, NULL, NULL, NULL, NULL, '118.75', '49599.50', 2, 2, '03-06-2021', 'June', '2021', '2021-06-02 18:00:00', 2, NULL, '2021-06-03 13:33:52', '2021-06-03 13:33:52'),
(110, 16, NULL, NULL, NULL, 167, NULL, NULL, NULL, NULL, NULL, '262.50', '5699.70', 2, 2, '05-06-2021', 'June', '2021', '2021-06-04 18:00:00', 2, NULL, '2021-06-05 05:36:29', '2021-06-05 05:36:29'),
(111, 15, NULL, NULL, NULL, 168, NULL, NULL, NULL, NULL, NULL, '767.25', '50366.75', 2, 2, '06-06-2021', 'June', '2021', '2021-06-05 18:00:00', 2, NULL, '2021-06-06 05:15:40', '2021-06-06 05:15:40'),
(112, 16, NULL, NULL, NULL, 140, NULL, NULL, NULL, NULL, NULL, '269.06', '5968.76', 2, 2, '2021-05-24', 'June', '2021', '2021-05-23 18:00:00', 7, NULL, '2021-06-07 09:41:46', '2021-06-07 09:41:46'),
(113, 15, NULL, NULL, NULL, 174, NULL, NULL, NULL, NULL, NULL, '300.00', '50666.75', 2, 2, '08-06-2021', 'June', '2021', '2021-06-07 18:00:00', 2, NULL, '2021-06-08 10:10:55', '2021-06-08 10:10:55'),
(114, 15, NULL, NULL, NULL, 175, NULL, NULL, NULL, NULL, NULL, '140.00', '50806.75', 2, 2, '08-06-2021', 'June', '2021', '2021-06-07 18:00:00', 2, NULL, '2021-06-08 10:18:13', '2021-06-08 10:18:13'),
(115, 15, NULL, NULL, NULL, 176, NULL, NULL, NULL, NULL, NULL, '131.25', '50938.00', 2, 2, '08-06-2021', 'June', '2021', '2021-06-07 18:00:00', 2, NULL, '2021-06-08 10:27:11', '2021-06-08 10:27:11'),
(116, 15, NULL, NULL, NULL, 177, NULL, NULL, NULL, NULL, NULL, '140.00', '51078.00', 2, 2, '08-06-2021', 'June', '2021', '2021-06-07 18:00:00', 2, NULL, '2021-06-08 10:27:24', '2021-06-08 10:27:24'),
(117, 15, NULL, NULL, NULL, 178, NULL, NULL, NULL, NULL, NULL, '140.00', '51218.00', 2, 2, '08-06-2021', 'June', '2021', '2021-06-07 18:00:00', 2, NULL, '2021-06-08 10:28:23', '2021-06-08 10:28:23'),
(118, 15, NULL, NULL, NULL, 179, NULL, NULL, NULL, NULL, NULL, '300.00', '51518.00', 2, 2, '08-06-2021', 'June', '2021', '2021-06-07 18:00:00', 2, NULL, '2021-06-08 10:31:36', '2021-06-08 10:31:36'),
(119, 15, NULL, NULL, NULL, 180, NULL, NULL, NULL, NULL, NULL, '300.00', '51818.00', 2, 2, '08-06-2021', 'June', '2021', '2021-06-07 18:00:00', 2, NULL, '2021-06-08 10:31:46', '2021-06-08 10:31:46'),
(120, 15, NULL, NULL, NULL, 181, NULL, NULL, NULL, NULL, NULL, '300.00', '52118.00', 2, 2, '08-06-2021', 'June', '2021', '2021-06-07 18:00:00', 2, NULL, '2021-06-08 10:32:26', '2021-06-08 10:32:26'),
(121, 15, NULL, NULL, NULL, 182, NULL, NULL, NULL, NULL, NULL, '300.00', '52418.00', 2, 2, '08-06-2021', 'June', '2021', '2021-06-07 18:00:00', 2, NULL, '2021-06-08 10:34:57', '2021-06-08 10:34:57'),
(122, 15, NULL, NULL, NULL, 183, NULL, NULL, NULL, NULL, NULL, '300.00', '52718.00', 2, 2, '08-06-2021', 'June', '2021', '2021-06-07 18:00:00', 2, NULL, '2021-06-08 10:35:05', '2021-06-08 10:35:05'),
(123, 15, NULL, NULL, NULL, 184, NULL, NULL, NULL, NULL, NULL, '300.00', '53018.00', 2, 2, '08-06-2021', 'June', '2021', '2021-06-07 18:00:00', 2, NULL, '2021-06-08 10:35:48', '2021-06-08 10:35:48'),
(124, 15, NULL, NULL, NULL, 185, NULL, NULL, NULL, NULL, NULL, '140.00', '53158.00', 2, 2, '08-06-2021', 'June', '2021', '2021-06-07 18:00:00', 2, NULL, '2021-06-08 10:36:05', '2021-06-08 10:36:05'),
(125, 15, NULL, NULL, NULL, 186, NULL, NULL, NULL, NULL, NULL, '140.00', '53298.00', 2, 2, '08-06-2021', 'June', '2021', '2021-06-07 18:00:00', 2, NULL, '2021-06-08 10:36:59', '2021-06-08 10:36:59'),
(126, 15, NULL, NULL, NULL, 187, NULL, NULL, NULL, NULL, NULL, '140.00', '53438.00', 2, 2, '08-06-2021', 'June', '2021', '2021-06-07 18:00:00', 2, NULL, '2021-06-08 10:39:17', '2021-06-08 10:39:17'),
(127, 15, NULL, NULL, NULL, 188, NULL, NULL, NULL, NULL, NULL, '140.00', '53578.00', 2, 2, '08-06-2021', 'June', '2021', '2021-06-07 18:00:00', 2, NULL, '2021-06-08 10:55:39', '2021-06-08 10:55:39'),
(128, 16, NULL, NULL, NULL, 201, NULL, NULL, NULL, NULL, '131.25', NULL, '5837.51', 2, 1, '2021-06-08', 'June', '2021', '2021-06-07 18:00:00', 2, NULL, '2021-06-08 12:09:44', '2021-06-08 12:09:44'),
(129, 15, NULL, NULL, NULL, 202, NULL, NULL, NULL, NULL, NULL, '140.00', '53718.00', 2, 2, '08-06-2021', 'June', '2021', '2021-06-07 18:00:00', 2, NULL, '2021-06-08 13:07:02', '2021-06-08 13:07:02'),
(130, 15, NULL, NULL, NULL, 203, NULL, NULL, NULL, NULL, NULL, '131.25', '53849.25', 2, 2, '08-06-2021', 'June', '2021', '2021-06-07 18:00:00', 2, NULL, '2021-06-08 13:10:33', '2021-06-08 13:10:33'),
(131, 15, NULL, NULL, NULL, 204, NULL, NULL, NULL, NULL, NULL, '109.25', '53958.50', 2, 2, '08-06-2021', 'June', '2021', '2021-06-07 18:00:00', 2, NULL, '2021-06-08 13:14:18', '2021-06-08 13:14:18'),
(132, 15, NULL, NULL, NULL, 205, NULL, NULL, NULL, NULL, NULL, '600.00', '54558.50', 2, 2, '08-06-2021', 'June', '2021', '2021-06-07 18:00:00', 2, NULL, '2021-06-08 13:18:17', '2021-06-08 13:18:17'),
(133, 15, NULL, NULL, NULL, 206, NULL, NULL, NULL, NULL, NULL, '125.00', '54683.50', 2, 2, '08-06-2021', 'June', '2021', '2021-06-07 18:00:00', 2, NULL, '2021-06-08 13:19:25', '2021-06-08 13:19:25'),
(134, 15, NULL, NULL, NULL, 208, NULL, NULL, NULL, NULL, NULL, '1600.00', '56283.50', 2, 2, '09-06-2021', 'June', '2021', '2021-06-08 18:00:00', 2, NULL, '2021-06-09 08:56:54', '2021-06-09 08:56:54'),
(135, 16, NULL, NULL, NULL, 209, NULL, NULL, NULL, NULL, NULL, '498.75', '5338.76', 2, 2, '09-06-2021', 'June', '2021', '2021-06-08 18:00:00', 2, NULL, '2021-06-09 09:24:42', '2021-06-09 09:24:42'),
(136, 16, NULL, NULL, NULL, 210, NULL, NULL, NULL, NULL, NULL, '31.00', '5307.76', 2, 2, '09-06-2021', 'June', '2021', '2021-06-08 18:00:00', 2, NULL, '2021-06-09 09:25:04', '2021-06-09 09:25:04'),
(139, 16, NULL, NULL, NULL, 213, NULL, NULL, NULL, NULL, NULL, '162.50', '100020.26', 2, 2, '09-06-2021', 'June', '2021', '2021-06-08 18:00:00', 2, NULL, '2021-06-09 09:27:00', '2021-06-09 09:27:00'),
(148, 15, NULL, NULL, NULL, NULL, NULL, NULL, 13, 15, '20490.00', NULL, '36843.50', 8, 1, '2021-06-10', 'June', '2021', '2021-06-09 18:00:00', 2, NULL, '2021-06-10 07:55:24', '2021-06-10 07:55:24'),
(149, 16, NULL, NULL, NULL, NULL, NULL, NULL, 14, 16, '20490.00', NULL, '79530.26', 8, 1, '2021-06-10', 'June', '2021', '2021-06-09 18:00:00', 2, NULL, '2021-06-10 08:42:26', '2021-06-10 08:42:26'),
(150, 15, NULL, NULL, NULL, 240, NULL, NULL, NULL, NULL, NULL, '140.00', '36983.50', 2, 2, '10-06-2021', 'June', '2021', '2021-06-09 18:00:00', 2, NULL, '2021-06-10 11:10:04', '2021-06-10 11:10:04'),
(151, 16, NULL, NULL, NULL, 245, NULL, NULL, NULL, NULL, NULL, '131.25', '79661.51', 2, 2, '15-06-2021', 'June', '2021', '2021-06-14 18:00:00', 2, NULL, '2021-06-15 06:18:20', '2021-06-15 06:18:20'),
(152, 16, NULL, NULL, 128, NULL, NULL, NULL, NULL, NULL, '800000.00', NULL, '-720338.49', 3, 1, '2021-06-17', 'June', '2021', '2021-06-16 18:00:00', 2, NULL, '2021-06-17 09:15:14', '2021-06-17 09:15:14'),
(153, 15, NULL, NULL, NULL, 251, NULL, NULL, NULL, NULL, NULL, '400.00', '37383.50', 2, 2, '17-06-2021', 'June', '2021', '2021-06-16 18:00:00', 2, NULL, '2021-06-17 10:44:49', '2021-06-17 10:44:49');

-- --------------------------------------------------------

--
-- Table structure for table `cash_registers`
--

CREATE TABLE `cash_registers` (
  `id` bigint(20) UNSIGNED NOT NULL,
  `branch_id` bigint(20) UNSIGNED DEFAULT NULL,
  `warehouse_id` bigint(20) UNSIGNED DEFAULT NULL,
  `account_id` bigint(20) UNSIGNED DEFAULT NULL,
  `admin_id` bigint(20) UNSIGNED DEFAULT NULL,
  `closed_at` timestamp NULL DEFAULT NULL,
  `closed_amount` decimal(22,2) NOT NULL DEFAULT 0.00,
  `total_card_slips` bigint(20) DEFAULT NULL,
  `total_cheques` bigint(20) DEFAULT NULL,
  `status` tinyint(1) NOT NULL DEFAULT 1 COMMENT '1=open;0=closed;',
  `closing_note` text COLLATE utf8mb4_unicode_ci DEFAULT NULL,
  `created_at` timestamp NULL DEFAULT NULL,
  `updated_at` timestamp NULL DEFAULT NULL,
  `cash_counter_id` bigint(20) UNSIGNED DEFAULT NULL
) ENGINE=InnoDB DEFAULT CHARSET=utf8mb4 COLLATE=utf8mb4_unicode_ci;

--
-- Dumping data for table `cash_registers`
--

INSERT INTO `cash_registers` (`id`, `branch_id`, `warehouse_id`, `account_id`, `admin_id`, `closed_at`, `closed_amount`, `total_card_slips`, `total_cheques`, `status`, `closing_note`, `created_at`, `updated_at`, `cash_counter_id`) VALUES
(1, NULL, 7, 15, 2, '2021-05-10 13:33:00', '100.00', 1, 0, 0, NULL, '2021-05-10 11:36:56', '2021-05-10 13:33:33', NULL),
(2, NULL, 7, 15, 2, '2021-05-10 13:48:00', '0.00', 0, 0, 0, NULL, '2021-05-10 13:33:55', '2021-05-10 13:48:07', NULL),
(3, NULL, 7, 16, 2, '2021-05-10 13:49:00', '200.00', 0, 0, 0, NULL, '2021-05-10 13:48:33', '2021-05-10 13:49:20', NULL),
(4, NULL, 7, NULL, 2, '2021-05-10 13:58:00', '100.00', 0, 0, 0, NULL, '2021-05-10 13:53:19', '2021-05-10 13:58:43', NULL),
(5, NULL, 7, 15, 2, '2021-05-17 11:52:00', '100.00', 0, 0, 0, NULL, '2021-05-11 03:21:08', '2021-05-17 11:52:01', NULL),
(6, 24, NULL, NULL, 7, '2021-05-18 08:12:00', '92100.00', 1, 0, 0, NULL, '2021-05-11 03:42:03', '2021-05-18 08:12:58', NULL),
(7, NULL, 7, 15, 2, '2021-06-05 05:35:00', '12455.00', 1, 0, 0, NULL, '2021-05-17 11:52:31', '2021-06-05 05:35:38', NULL),
(8, 24, NULL, NULL, 7, '2021-05-24 04:52:00', '1000.00', 0, 0, 0, NULL, '2021-05-18 08:13:09', '2021-05-24 04:52:54', NULL),
(9, 24, NULL, NULL, 7, '2021-06-07 11:43:00', '610.00', 0, 0, 0, NULL, '2021-05-24 04:53:01', '2021-06-07 11:43:28', NULL),
(10, NULL, 7, 16, 2, '2021-06-05 07:45:00', '362.50', 0, 0, 0, NULL, '2021-06-05 05:35:52', '2021-06-05 07:45:44', NULL),
(11, NULL, 7, 15, 2, '2021-06-22 05:57:00', '7075.50', 0, 0, 0, NULL, '2021-06-05 12:36:54', '2021-06-22 05:57:57', NULL),
(12, 24, NULL, NULL, 7, NULL, '0.00', NULL, NULL, 1, NULL, '2021-06-07 11:43:34', '2021-06-07 11:43:34', NULL),
(13, 24, NULL, NULL, 10, '2021-06-09 10:34:00', '1000.00', 0, 0, 0, NULL, '2021-06-09 10:32:29', '2021-06-09 10:34:55', NULL),
(14, 24, NULL, NULL, 10, NULL, '0.00', NULL, NULL, 1, NULL, '2021-06-09 10:35:09', '2021-06-09 10:35:09', NULL),
(15, NULL, 7, NULL, 2, '2021-06-22 06:19:00', '100.00', 0, 0, 0, NULL, '2021-06-22 06:17:32', '2021-06-22 06:19:04', NULL),
(16, NULL, 7, 15, 2, '2021-06-22 06:26:00', '0.00', 0, 0, 0, NULL, '2021-06-22 06:25:55', '2021-06-22 06:26:51', NULL),
(17, NULL, 7, 15, 2, '2021-06-22 06:26:00', '100.00', 0, 0, 0, NULL, '2021-06-22 06:26:43', '2021-06-22 06:26:56', 2),
(18, NULL, 7, NULL, 2, '2021-06-22 06:54:00', '0.00', 0, 0, 0, NULL, '2021-06-22 06:27:04', '2021-06-22 06:54:07', 2);

-- --------------------------------------------------------

--
-- Table structure for table `cash_register_transactions`
--

CREATE TABLE `cash_register_transactions` (
  `id` bigint(20) UNSIGNED NOT NULL,
  `cash_register_id` bigint(20) UNSIGNED DEFAULT NULL,
  `sale_id` bigint(20) UNSIGNED DEFAULT NULL,
  `cash_type` tinyint(4) NOT NULL DEFAULT 2 COMMENT '1=debit;2=credit',
  `transaction_type` tinyint(4) NOT NULL DEFAULT 2 COMMENT '1=initial;2=sale',
  `amount` decimal(22,2) DEFAULT NULL,
  `created_at` timestamp NULL DEFAULT NULL,
  `updated_at` timestamp NULL DEFAULT NULL
) ENGINE=InnoDB DEFAULT CHARSET=utf8mb4 COLLATE=utf8mb4_unicode_ci;

--
-- Dumping data for table `cash_register_transactions`
--

INSERT INTO `cash_register_transactions` (`id`, `cash_register_id`, `sale_id`, `cash_type`, `transaction_type`, `amount`, `created_at`, `updated_at`) VALUES
(1, 1, NULL, 2, 1, '100.00', '2021-05-10 11:36:56', '2021-05-10 11:36:56'),
(2, 1, 145, 2, 2, NULL, '2021-05-10 13:06:22', '2021-05-10 13:06:22'),
(3, 2, NULL, 2, 1, '0.00', '2021-05-10 13:33:55', '2021-05-10 13:33:55'),
(4, 3, NULL, 2, 1, '200.00', '2021-05-10 13:48:33', '2021-05-10 13:48:33'),
(5, 4, NULL, 2, 1, '100.00', '2021-05-10 13:53:19', '2021-05-10 13:53:19'),
(6, 5, NULL, 2, 1, '100.00', '2021-05-11 03:21:08', '2021-05-11 03:21:08'),
(7, 5, 146, 2, 2, NULL, '2021-05-11 03:25:55', '2021-05-11 03:25:55'),
(8, 5, 147, 2, 2, NULL, '2021-05-11 03:30:38', '2021-05-11 03:30:38'),
(9, 6, NULL, 2, 1, '100.00', '2021-05-11 03:42:03', '2021-05-11 03:42:03'),
(10, 6, 150, 2, 2, NULL, '2021-05-11 04:07:10', '2021-05-11 04:07:10'),
(11, 6, 151, 2, 2, NULL, '2021-05-11 04:15:35', '2021-05-11 04:15:35'),
(12, 6, 152, 2, 2, NULL, '2021-05-11 04:18:53', '2021-05-11 04:18:53'),
(13, 6, 153, 2, 2, NULL, '2021-05-11 08:42:07', '2021-05-11 08:42:07'),
(15, 7, NULL, 2, 1, '1000.00', '2021-05-17 11:52:31', '2021-05-17 11:52:31'),
(17, 7, 156, 2, 2, NULL, '2021-05-18 07:23:29', '2021-05-18 07:23:29'),
(18, 7, 157, 2, 2, NULL, '2021-05-18 07:26:26', '2021-05-18 07:26:26'),
(19, 7, 158, 2, 2, NULL, '2021-05-18 07:32:40', '2021-05-18 07:32:40'),
(20, 8, NULL, 2, 1, '1000.00', '2021-05-18 08:13:09', '2021-05-18 08:13:09'),
(21, 7, 159, 2, 2, NULL, '2021-05-18 09:28:34', '2021-05-18 09:28:34'),
(22, 7, 160, 2, 2, NULL, '2021-05-18 13:23:04', '2021-05-18 13:23:04'),
(23, 7, 161, 2, 2, NULL, '2021-05-18 13:30:41', '2021-05-18 13:30:41'),
(28, 7, 166, 2, 2, NULL, '2021-05-19 05:02:33', '2021-05-19 05:02:33'),
(29, 7, 172, 2, 2, NULL, '2021-05-22 05:17:06', '2021-05-22 05:17:06'),
(30, 7, 173, 2, 2, NULL, '2021-05-23 12:21:53', '2021-05-23 12:21:53'),
(31, 9, NULL, 2, 1, '100.00', '2021-05-24 04:53:01', '2021-05-24 04:53:01'),
(32, 7, 176, 2, 2, NULL, '2021-06-01 13:24:46', '2021-06-01 13:24:46'),
(41, 7, 189, 2, 2, NULL, '2021-06-03 05:16:40', '2021-06-03 05:16:40'),
(43, 7, 191, 2, 2, NULL, '2021-06-03 07:51:44', '2021-06-03 07:51:44'),
(44, 7, 192, 2, 2, NULL, '2021-06-03 11:09:35', '2021-06-03 11:09:35'),
(45, 7, 193, 2, 2, NULL, '2021-06-03 12:36:12', '2021-06-03 12:36:12'),
(46, 7, 194, 2, 2, NULL, '2021-06-03 12:57:26', '2021-06-03 12:57:26'),
(47, 7, 195, 2, 2, NULL, '2021-06-03 13:11:16', '2021-06-03 13:11:16'),
(48, 7, 196, 2, 2, NULL, '2021-06-03 13:21:23', '2021-06-03 13:21:23'),
(49, 7, 197, 2, 2, NULL, '2021-06-03 13:24:06', '2021-06-03 13:24:06'),
(50, 7, 198, 2, 2, NULL, '2021-06-03 13:25:26', '2021-06-03 13:25:26'),
(51, 7, 199, 2, 2, NULL, '2021-06-03 13:28:35', '2021-06-03 13:28:35'),
(52, 7, 200, 2, 2, NULL, '2021-06-03 13:31:57', '2021-06-03 13:31:57'),
(53, 10, NULL, 2, 1, '100.00', '2021-06-05 05:35:52', '2021-06-05 05:35:52'),
(54, 10, 201, 2, 2, NULL, '2021-06-05 05:36:29', '2021-06-05 05:36:29'),
(55, 11, NULL, 2, 1, '100.00', '2021-06-05 12:36:54', '2021-06-05 12:36:54'),
(56, 11, 206, 2, 2, NULL, '2021-06-06 11:22:47', '2021-06-06 11:22:47'),
(57, 9, 207, 2, 2, NULL, '2021-06-07 11:40:46', '2021-06-07 11:40:46'),
(58, 9, 208, 2, 2, NULL, '2021-06-07 11:41:46', '2021-06-07 11:41:46'),
(59, 12, NULL, 2, 1, '100.00', '2021-06-07 11:43:34', '2021-06-07 11:43:34'),
(60, 11, 209, 2, 2, NULL, '2021-06-08 10:10:55', '2021-06-08 10:10:55'),
(61, 11, 210, 2, 2, NULL, '2021-06-08 10:18:13', '2021-06-08 10:18:13'),
(62, 11, 211, 2, 2, NULL, '2021-06-08 10:27:11', '2021-06-08 10:27:11'),
(63, 11, 212, 2, 2, NULL, '2021-06-08 10:27:24', '2021-06-08 10:27:24'),
(64, 11, 213, 2, 2, NULL, '2021-06-08 10:28:23', '2021-06-08 10:28:23'),
(65, 11, 214, 2, 2, NULL, '2021-06-08 10:31:36', '2021-06-08 10:31:36'),
(66, 11, 215, 2, 2, NULL, '2021-06-08 10:31:46', '2021-06-08 10:31:46'),
(67, 11, 216, 2, 2, NULL, '2021-06-08 10:32:26', '2021-06-08 10:32:26'),
(68, 11, 217, 2, 2, NULL, '2021-06-08 10:34:57', '2021-06-08 10:34:57'),
(69, 11, 218, 2, 2, NULL, '2021-06-08 10:35:05', '2021-06-08 10:35:05'),
(70, 11, 219, 2, 2, NULL, '2021-06-08 10:35:48', '2021-06-08 10:35:48'),
(71, 11, 220, 2, 2, NULL, '2021-06-08 10:36:05', '2021-06-08 10:36:05'),
(72, 11, 221, 2, 2, NULL, '2021-06-08 10:36:59', '2021-06-08 10:36:59'),
(73, 11, 222, 2, 2, NULL, '2021-06-08 10:39:17', '2021-06-08 10:39:17'),
(74, 11, 223, 2, 2, NULL, '2021-06-08 10:55:39', '2021-06-08 10:55:39'),
(75, 11, 224, 2, 2, NULL, '2021-06-08 11:08:25', '2021-06-08 11:08:25'),
(76, 11, 225, 2, 2, NULL, '2021-06-08 11:09:27', '2021-06-08 11:09:27'),
(77, 11, 238, 2, 2, NULL, '2021-06-08 13:18:17', '2021-06-08 13:18:17'),
(78, 11, 240, 2, 2, NULL, '2021-06-09 08:56:54', '2021-06-09 08:56:54'),
(79, 13, NULL, 2, 1, '1000.00', '2021-06-09 10:32:29', '2021-06-09 10:32:29'),
(80, 14, NULL, 2, 1, '100.00', '2021-06-09 10:35:10', '2021-06-09 10:35:10'),
(82, 14, 242, 2, 2, NULL, '2021-06-09 10:51:38', '2021-06-09 10:51:38'),
(83, 14, 243, 2, 2, NULL, '2021-06-09 10:53:57', '2021-06-09 10:53:57'),
(84, 14, 244, 2, 2, NULL, '2021-06-09 11:04:20', '2021-06-09 11:04:20'),
(85, 14, 245, 2, 2, NULL, '2021-06-09 11:07:10', '2021-06-09 11:07:10'),
(86, 11, 256, 2, 2, NULL, '2021-06-10 11:10:04', '2021-06-10 11:10:04'),
(87, 12, 257, 2, 2, NULL, '2021-06-10 11:10:59', '2021-06-10 11:10:59'),
(88, 11, 266, 2, 2, NULL, '2021-06-17 10:44:49', '2021-06-17 10:44:49'),
(89, 15, NULL, 2, 1, '100.00', '2021-06-22 06:17:32', '2021-06-22 06:17:32'),
(90, 17, NULL, 2, 1, '100.00', '2021-06-22 06:26:43', '2021-06-22 06:26:43'),
(91, 18, NULL, 2, 1, '0.00', '2021-06-22 06:27:04', '2021-06-22 06:27:04');

-- --------------------------------------------------------

--
-- Table structure for table `categories`
--

CREATE TABLE `categories` (
  `id` bigint(20) UNSIGNED NOT NULL,
  `name` varchar(255) COLLATE utf8mb4_unicode_ci NOT NULL,
  `parent_category_id` bigint(20) UNSIGNED DEFAULT NULL,
  `photo` varchar(255) COLLATE utf8mb4_unicode_ci NOT NULL DEFAULT 'default.png',
  `status` tinyint(1) NOT NULL DEFAULT 1,
  `created_at` timestamp NULL DEFAULT NULL,
  `updated_at` timestamp NULL DEFAULT NULL
) ENGINE=InnoDB DEFAULT CHARSET=utf8mb4 COLLATE=utf8mb4_unicode_ci;

--
-- Dumping data for table `categories`
--

INSERT INTO `categories` (`id`, `name`, `parent_category_id`, `photo`, `status`, `created_at`, `updated_at`) VALUES
(31, 'Food', NULL, 'default.png', 1, '2021-03-07 05:49:51', '2021-03-07 05:49:51'),
(34, 'Laptop', NULL, 'default.png', 1, '2021-03-08 11:05:39', '2021-05-06 03:38:11'),
(35, 'Baby Items', NULL, 'default.png', 1, NULL, '2021-05-06 03:37:50'),
(38, 'Service', NULL, 'default.png', 1, NULL, '2021-05-06 03:35:47'),
(39, 'Matarial', NULL, 'default.png', 1, NULL, '2021-05-06 03:35:03'),
(41, 'Garments', NULL, '609363d78e259.jpg', 1, NULL, '2021-05-06 03:34:47'),
(46, 'EM', 47, '60bb686bddc76.png', 1, NULL, '2021-06-17 07:49:24'),
(47, 'Electronic', NULL, '6092360456595.jpg', 1, '2021-04-28 05:18:58', '2021-05-05 06:07:00'),
(48, 'Sam', NULL, 'default.png', 1, NULL, NULL),
(50, 'Sam-2', NULL, 'default.png', 1, NULL, NULL),
(51, 'Mobile Phone', 47, 'default.png', 1, NULL, NULL),
(52, 'Television', 47, 'default.png', 1, NULL, NULL),
(53, 'Air conditioner', 47, 'default.png', 1, NULL, NULL);

-- --------------------------------------------------------

--
-- Table structure for table `combo_products`
--

CREATE TABLE `combo_products` (
  `id` bigint(20) UNSIGNED NOT NULL,
  `product_id` bigint(20) UNSIGNED DEFAULT NULL,
  `combo_product_id` bigint(20) UNSIGNED DEFAULT NULL,
  `quantity` decimal(22,2) DEFAULT 0.00,
  `product_variant_id` bigint(20) UNSIGNED DEFAULT NULL,
  `delete_in_update` tinyint(1) NOT NULL DEFAULT 0,
  `created_at` timestamp NULL DEFAULT NULL,
  `updated_at` timestamp NULL DEFAULT NULL
) ENGINE=InnoDB DEFAULT CHARSET=utf8mb4 COLLATE=utf8mb4_unicode_ci;

-- --------------------------------------------------------

--
-- Table structure for table `currencies`
--

CREATE TABLE `currencies` (
  `id` int(10) UNSIGNED NOT NULL,
  `country` varchar(100) COLLATE utf8mb4_unicode_ci NOT NULL,
  `currency` varchar(100) COLLATE utf8mb4_unicode_ci NOT NULL,
  `code` varchar(25) COLLATE utf8mb4_unicode_ci NOT NULL,
  `symbol` varchar(25) COLLATE utf8mb4_unicode_ci NOT NULL,
  `thousand_separator` varchar(10) COLLATE utf8mb4_unicode_ci NOT NULL,
  `decimal_separator` varchar(10) COLLATE utf8mb4_unicode_ci NOT NULL,
  `created_at` timestamp NULL DEFAULT NULL,
  `updated_at` timestamp NULL DEFAULT NULL
) ENGINE=InnoDB DEFAULT CHARSET=utf8mb4 COLLATE=utf8mb4_unicode_ci;

--
-- Dumping data for table `currencies`
--

INSERT INTO `currencies` (`id`, `country`, `currency`, `code`, `symbol`, `thousand_separator`, `decimal_separator`, `created_at`, `updated_at`) VALUES
(1, 'Albania', 'Leke', 'ALL', 'Lek', ',', '.', NULL, NULL),
(2, 'America', 'Dollars', 'USD', '$', ',', '.', NULL, NULL),
(3, 'Afghanistan', 'Afghanis', 'AF', '', ',', '.', NULL, NULL),
(4, 'Argentina', 'Pesos', 'ARS', '$', ',', '.', NULL, NULL),
(5, 'Aruba', 'Guilders', 'AWG', '', ',', '.', NULL, NULL),
(6, 'Australia', 'Dollars', 'AUD', '$', ',', '.', NULL, NULL),
(7, 'Azerbaijan', 'New Manats', 'AZ', '', ',', '.', NULL, NULL),
(8, 'Bahamas', 'Dollars', 'BSD', '$', ',', '.', NULL, NULL),
(9, 'Barbados', 'Dollars', 'BBD', '$', ',', '.', NULL, NULL),
(10, 'Belarus', 'Rubles', 'BYR', 'p.', ',', '.', NULL, NULL),
(11, 'Belgium', 'Euro', 'EUR', '', ',', '.', NULL, NULL),
(12, 'Beliz', 'Dollars', 'BZD', 'BZ$', ',', '.', NULL, NULL),
(13, 'Bermuda', 'Dollars', 'BMD', '$', ',', '.', NULL, NULL),
(14, 'Bolivia', 'Bolivianos', 'BOB', '$b', ',', '.', NULL, NULL),
(15, 'Bosnia and Herzegovina', 'Convertible Marka', 'BAM', 'KM', ',', '.', NULL, NULL),
(16, 'Botswana', 'Pula\'s', 'BWP', 'P', ',', '.', NULL, NULL),
(17, 'Bulgaria', 'Leva', 'BG', '', ',', '.', NULL, NULL),
(18, 'Brazil', 'Reais', 'BRL', 'R$', ',', '.', NULL, NULL),
(19, 'Britain [United Kingdom]', 'Pounds', 'GBP', '', ',', '.', NULL, NULL),
(20, 'Brunei Darussalam', 'Dollars', 'BND', '$', ',', '.', NULL, NULL),
(21, 'Cambodia', 'Riels', 'KHR', '', ',', '.', NULL, NULL),
(22, 'Canada', 'Dollars', 'CAD', '$', ',', '.', NULL, NULL),
(23, 'Cayman Islands', 'Dollars', 'KYD', '$', ',', '.', NULL, NULL),
(24, 'Chile', 'Pesos', 'CLP', '$', ',', '.', NULL, NULL),
(25, 'China', 'Yuan Renminbi', 'CNY', '', ',', '.', NULL, NULL),
(26, 'Colombia', 'Pesos', 'COP', '$', ',', '.', NULL, NULL),
(27, 'Costa Rica', 'Coln', 'CRC', '', ',', '.', NULL, NULL),
(28, 'Croatia', 'Kuna', 'HRK', 'kn', ',', '.', NULL, NULL),
(29, 'Cuba', 'Pesos', 'CUP', '', ',', '.', NULL, NULL),
(30, 'Cyprus', 'Euro', 'EUR', '', '.', ',', NULL, NULL),
(31, 'Czech Republic', 'Koruny', 'CZK', 'K', ',', '.', NULL, NULL),
(32, 'Denmark', 'Kroner', 'DKK', 'kr', ',', '.', NULL, NULL),
(33, 'Dominican Republic', 'Pesos', 'DOP ', 'RD$', ',', '.', NULL, NULL),
(34, 'East Caribbean', 'Dollars', 'XCD', '$', ',', '.', NULL, NULL),
(35, 'Egypt', 'Pounds', 'EGP', '', ',', '.', NULL, NULL),
(36, 'El Salvador', 'Colones', 'SVC', '$', ',', '.', NULL, NULL),
(37, 'England [United Kingdom]', 'Pounds', 'GBP', '', ',', '.', NULL, NULL),
(38, 'Euro', 'Euro', 'EUR', '', '.', ',', NULL, NULL),
(39, 'Falkland Islands', 'Pounds', 'FKP', '', ',', '.', NULL, NULL),
(40, 'Fiji', 'Dollars', 'FJD', '$', ',', '.', NULL, NULL),
(41, 'France', 'Euro', 'EUR', '', '.', ',', NULL, NULL),
(42, 'Ghana', 'Cedis', 'GHC', '', ',', '.', NULL, NULL),
(43, 'Gibraltar', 'Pounds', 'GIP', '', ',', '.', NULL, NULL),
(44, 'Greece', 'Euro', 'EUR', '', '.', ',', NULL, NULL),
(45, 'Guatemala', 'Quetzales', 'GTQ', 'Q', ',', '.', NULL, NULL),
(46, 'Guernsey', 'Pounds', 'GGP', '', ',', '.', NULL, NULL),
(47, 'Guyana', 'Dollars', 'GYD', '$', ',', '.', NULL, NULL),
(48, 'Holland [Netherlands]', 'Euro', 'EUR', '', '.', ',', NULL, NULL),
(49, 'Honduras', 'Lempiras', 'HNL', 'L', ',', '.', NULL, NULL),
(50, 'Hong Kong', 'Dollars', 'HKD', '$', ',', '.', NULL, NULL),
(51, 'Hungary', 'Forint', 'HUF', 'Ft', ',', '.', NULL, NULL),
(52, 'Iceland', 'Kronur', 'ISK', 'kr', ',', '.', NULL, NULL),
(53, 'India', 'Rupees', 'INR', '', ',', '.', NULL, NULL),
(54, 'Indonesia', 'Rupiahs', 'IDR', 'Rp', ',', '.', NULL, NULL),
(55, 'Iran', 'Rials', 'IRR', '', ',', '.', NULL, NULL),
(56, 'Ireland', 'Euro', 'EUR', '', '.', ',', NULL, NULL),
(57, 'Isle of Man', 'Pounds', 'IMP', '', ',', '.', NULL, NULL),
(58, 'Israel', 'New Shekels', 'ILS', '', ',', '.', NULL, NULL),
(59, 'Italy', 'Euro', 'EUR', '', '.', ',', NULL, NULL),
(60, 'Jamaica', 'Dollars', 'JMD', 'J$', ',', '.', NULL, NULL),
(61, 'Japan', 'Yen', 'JPY', '', ',', '.', NULL, NULL),
(62, 'Jersey', 'Pounds', 'JEP', '', ',', '.', NULL, NULL),
(63, 'Kazakhstan', 'Tenge', 'KZT', '', ',', '.', NULL, NULL),
(64, 'Korea [North]', 'Won', 'KPW', '', ',', '.', NULL, NULL),
(65, 'Korea [South]', 'Won', 'KRW', '', ',', '.', NULL, NULL),
(66, 'Kyrgyzstan', 'Soms', 'KGS', '', ',', '.', NULL, NULL),
(67, 'Laos', 'Kips', 'LAK', '', ',', '.', NULL, NULL),
(68, 'Latvia', 'Lati', 'LVL', 'Ls', ',', '.', NULL, NULL),
(69, 'Lebanon', 'Pounds', 'LBP', '', ',', '.', NULL, NULL),
(70, 'Liberia', 'Dollars', 'LRD', '$', ',', '.', NULL, NULL),
(71, 'Liechtenstein', 'Switzerland Francs', 'CHF', 'CHF', ',', '.', NULL, NULL),
(72, 'Lithuania', 'Litai', 'LTL', 'Lt', ',', '.', NULL, NULL),
(73, 'Luxembourg', 'Euro', 'EUR', '', '.', ',', NULL, NULL),
(74, 'Macedonia', 'Denars', 'MKD', '', ',', '.', NULL, NULL),
(75, 'Malaysia', 'Ringgits', 'MYR', 'RM', ',', '.', NULL, NULL),
(76, 'Malta', 'Euro', 'EUR', '', '.', ',', NULL, NULL),
(77, 'Mauritius', 'Rupees', 'MUR', '', ',', '.', NULL, NULL),
(78, 'Mexico', 'Pesos', 'MXN', '$', ',', '.', NULL, NULL),
(79, 'Mongolia', 'Tugriks', 'MNT', '', ',', '.', NULL, NULL),
(80, 'Mozambique', 'Meticais', 'MZ', 'MT', ',', '.', NULL, NULL),
(81, 'Namibia', 'Dollars', 'NAD', '$', ',', '.', NULL, NULL),
(82, 'Nepal', 'Rupees', 'NPR', '', ',', '.', NULL, NULL),
(83, 'Netherlands Antilles', 'Guilders', 'ANG', '', ',', '.', NULL, NULL),
(84, 'Netherlands', 'Euro', 'EUR', '', '.', ',', NULL, NULL),
(85, 'New Zealand', 'Dollars', 'NZD', '$', ',', '.', NULL, NULL),
(86, 'Nicaragua', 'Cordobas', 'NIO', 'C$', ',', '.', NULL, NULL),
(87, 'Nigeria', 'Nairas', 'NG', '', ',', '.', NULL, NULL),
(88, 'North Korea', 'Won', 'KPW', '', ',', '.', NULL, NULL),
(89, 'Norway', 'Krone', 'NOK', 'kr', ',', '.', NULL, NULL),
(90, 'Oman', 'Rials', 'OMR', '', ',', '.', NULL, NULL),
(91, 'Pakistan', 'Rupees', 'PKR', '', ',', '.', NULL, NULL),
(92, 'Panama', 'Balboa', 'PAB', 'B/.', ',', '.', NULL, NULL),
(93, 'Paraguay', 'Guarani', 'PYG', 'Gs', ',', '.', NULL, NULL),
(94, 'Peru', 'Nuevos Soles', 'PE', 'S/.', ',', '.', NULL, NULL),
(95, 'Philippines', 'Pesos', 'PHP', 'Php', ',', '.', NULL, NULL),
(96, 'Poland', 'Zlotych', 'PL', 'z', ',', '.', NULL, NULL),
(97, 'Qatar', 'Rials', 'QAR', '', ',', '.', NULL, NULL),
(98, 'Romania', 'New Lei', 'RO', 'lei', ',', '.', NULL, NULL),
(99, 'Russia', 'Rubles', 'RUB', '', ',', '.', NULL, NULL),
(100, 'Saint Helena', 'Pounds', 'SHP', '', ',', '.', NULL, NULL),
(101, 'Saudi Arabia', 'Riyals', 'SAR', '', ',', '.', NULL, NULL),
(102, 'Serbia', 'Dinars', 'RSD', '.', ',', '.', NULL, NULL),
(103, 'Seychelles', 'Rupees', 'SCR', '', ',', '.', NULL, NULL),
(104, 'Singapore', 'Dollars', 'SGD', '$', ',', '.', NULL, NULL),
(105, 'Slovenia', 'Euro', 'EUR', '', '.', ',', NULL, NULL),
(106, 'Solomon Islands', 'Dollars', 'SBD', '$', ',', '.', NULL, NULL),
(107, 'Somalia', 'Shillings', 'SOS', 'S', ',', '.', NULL, NULL),
(108, 'South Africa', 'Rand', 'ZAR', 'R', ',', '.', NULL, NULL),
(109, 'South Korea', 'Won', 'KRW', '', ',', '.', NULL, NULL),
(110, 'Spain', 'Euro', 'EUR', '', '.', ',', NULL, NULL),
(111, 'Sri Lanka', 'Rupees', 'LKR', '', ',', '.', NULL, NULL),
(112, 'Sweden', 'Kronor', 'SEK', 'kr', ',', '.', NULL, NULL),
(113, 'Switzerland', 'Francs', 'CHF', 'CHF', ',', '.', NULL, NULL),
(114, 'Suriname', 'Dollars', 'SRD', '$', ',', '.', NULL, NULL),
(115, 'Syria', 'Pounds', 'SYP', '', ',', '.', NULL, NULL),
(116, 'Taiwan', 'New Dollars', 'TWD', 'NT$', ',', '.', NULL, NULL),
(117, 'Thailand', 'Baht', 'THB', '', ',', '.', NULL, NULL),
(118, 'Trinidad and Tobago', 'Dollars', 'TTD', 'TT$', ',', '.', NULL, NULL),
(119, 'Turkey', 'Lira', 'TRY', 'TL', ',', '.', NULL, NULL),
(120, 'Turkey', 'Liras', 'TRL', '', ',', '.', NULL, NULL),
(121, 'Tuvalu', 'Dollars', 'TVD', '$', ',', '.', NULL, NULL),
(122, 'Ukraine', 'Hryvnia', 'UAH', '', ',', '.', NULL, NULL),
(123, 'United Kingdom', 'Pounds', 'GBP', '', ',', '.', NULL, NULL),
(124, 'United States of America', 'Dollars', 'USD', '$', ',', '.', NULL, NULL),
(125, 'Uruguay', 'Pesos', 'UYU', '$U', ',', '.', NULL, NULL),
(126, 'Uzbekistan', 'Sums', 'UZS', '', ',', '.', NULL, NULL),
(127, 'Vatican City', 'Euro', 'EUR', '', '.', ',', NULL, NULL),
(128, 'Venezuela', 'Bolivares Fuertes', 'VEF', 'Bs', ',', '.', NULL, NULL),
(129, 'Vietnam', 'Dong', 'VND', '', ',', '.', NULL, NULL),
(130, 'Yemen', 'Rials', 'YER', '', ',', '.', NULL, NULL),
(131, 'Zimbabwe', 'Zimbabwe Dollars', 'ZWD', 'Z$', ',', '.', NULL, NULL),
(132, 'Iraq', 'Iraqi dinar', 'IQD', '.', ',', '.', NULL, NULL),
(133, 'Kenya', 'Kenyan shilling', 'KES', 'KSh', ',', '.', NULL, NULL),
(134, 'Bangladesh', 'Taka', 'BDT', '', ',', '.', NULL, NULL),
(135, 'Algerie', 'Algerian dinar', 'DZD', '.', ' ', '.', NULL, NULL),
(136, 'United Arab Emirates', 'United Arab Emirates dirham', 'AED', '.', ',', '.', NULL, NULL),
(137, 'Uganda', 'Uganda shillings', 'UGX', 'USh', ',', '.', NULL, NULL),
(138, 'Tanzania', 'Tanzanian shilling', 'TZS', 'TSh', ',', '.', NULL, NULL),
(139, 'Angola', 'Kwanza', 'AOA', 'Kz', ',', '.', NULL, NULL),
(140, 'Kuwait', 'Kuwaiti dinar', 'KWD', 'KD', ',', '.', NULL, NULL);

-- --------------------------------------------------------

--
-- Table structure for table `customers`
--

CREATE TABLE `customers` (
  `id` bigint(20) UNSIGNED NOT NULL,
  `type` tinyint(4) DEFAULT NULL COMMENT '1=customer,2=supplier,3=both',
  `contact_id` varchar(255) COLLATE utf8mb4_unicode_ci DEFAULT NULL,
  `customer_group_id` bigint(20) UNSIGNED DEFAULT NULL,
  `name` varchar(255) COLLATE utf8mb4_unicode_ci NOT NULL,
  `business_name` varchar(255) COLLATE utf8mb4_unicode_ci DEFAULT NULL,
  `phone` varchar(255) COLLATE utf8mb4_unicode_ci DEFAULT NULL,
  `alternative_phone` varchar(255) COLLATE utf8mb4_unicode_ci DEFAULT NULL,
  `landline` varchar(255) COLLATE utf8mb4_unicode_ci DEFAULT NULL,
  `email` varchar(255) COLLATE utf8mb4_unicode_ci DEFAULT NULL,
  `date_of_birth` varchar(255) COLLATE utf8mb4_unicode_ci DEFAULT NULL,
  `tax_number` varchar(255) COLLATE utf8mb4_unicode_ci DEFAULT NULL,
  `opening_balance` decimal(22,2) NOT NULL DEFAULT 0.00,
  `pay_term` tinyint(4) DEFAULT NULL COMMENT '1=months,2=days',
  `pay_term_number` int(11) DEFAULT NULL,
  `address` mediumtext COLLATE utf8mb4_unicode_ci DEFAULT NULL,
  `shipping_address` mediumtext COLLATE utf8mb4_unicode_ci DEFAULT NULL,
  `city` varchar(255) COLLATE utf8mb4_unicode_ci DEFAULT NULL,
  `state` varchar(255) COLLATE utf8mb4_unicode_ci DEFAULT NULL,
  `country` varchar(255) COLLATE utf8mb4_unicode_ci DEFAULT NULL,
  `zip_code` varchar(255) COLLATE utf8mb4_unicode_ci DEFAULT NULL,
  `total_sale` decimal(22,2) NOT NULL DEFAULT 0.00,
  `total_paid` decimal(22,2) NOT NULL DEFAULT 0.00,
  `total_sale_due` decimal(22,2) NOT NULL DEFAULT 0.00,
  `total_sale_return_due` decimal(22,2) NOT NULL DEFAULT 0.00,
  `point` decimal(22,2) NOT NULL DEFAULT 0.00,
  `status` tinyint(1) NOT NULL DEFAULT 1,
  `is_walk_in_customer` tinyint(1) NOT NULL DEFAULT 0,
  `created_at` timestamp NULL DEFAULT NULL,
  `updated_at` timestamp NULL DEFAULT NULL
) ENGINE=InnoDB DEFAULT CHARSET=utf8mb4 COLLATE=utf8mb4_unicode_ci;

--
-- Dumping data for table `customers`
--

INSERT INTO `customers` (`id`, `type`, `contact_id`, `customer_group_id`, `name`, `business_name`, `phone`, `alternative_phone`, `landline`, `email`, `date_of_birth`, `tax_number`, `opening_balance`, `pay_term`, `pay_term_number`, `address`, `shipping_address`, `city`, `state`, `country`, `zip_code`, `total_sale`, `total_paid`, `total_sale_due`, `total_sale_return_due`, `point`, `status`, `is_walk_in_customer`, `created_at`, `updated_at`) VALUES
(39, 2, 'CT788', 4, 'John Miller', 'X Enterprice', '015879966655', '015879966655', '015879966655', NULL, '2021-04-04', '4455887', '0.00', 1, NULL, 'Dhaka, Bangladesh', 'Dhaka,Bangladesh', NULL, NULL, NULL, NULL, '151427.50', '-108080.25', '-38706.75', '0.00', '0.00', 1, 0, '2021-04-04 07:21:07', '2021-06-03 05:13:59'),
(40, NULL, NULL, NULL, 'Trip', NULL, '01856742357', '01856742357', '01856742357', NULL, NULL, NULL, '0.00', 1, NULL, NULL, NULL, NULL, NULL, NULL, NULL, '2057.50', '1042.50', '0.00', '0.00', '0.00', 1, 0, '2021-04-17 03:33:36', '2021-06-09 09:24:42'),
(41, 2, 'CO75555', 4, 'Mr. Bill', 'X Company', '01853247521', '01853247521', '01853247521', NULL, NULL, NULL, '200.00', 1, NULL, NULL, NULL, NULL, NULL, NULL, NULL, '5013.00', '6273.62', '-742.50', '221.25', '0.00', 1, 0, '2021-04-17 04:05:36', '2021-06-10 06:37:39'),
(42, NULL, NULL, NULL, 'Jarif', NULL, '0158745212365', '0158745212365', '0158745212365', NULL, NULL, NULL, '500.00', 1, NULL, NULL, NULL, NULL, NULL, NULL, NULL, '1972.50', '2472.50', '0.00', '0.00', '0.00', 1, 0, '2021-04-17 04:08:20', '2021-06-03 12:14:38'),
(43, 2, 'CO75558', NULL, 'Jefferson', NULL, '01856324756', '01856324756', '01856324756', NULL, NULL, NULL, '700.00', 1, NULL, NULL, NULL, NULL, NULL, NULL, NULL, '8846.25', '7866.25', '1680.00', '0.00', '0.00', 1, 0, '2021-04-17 04:10:35', '2021-06-03 12:33:28'),
(44, NULL, NULL, NULL, 'Nikson', NULL, '01255785544', '01255785544', '01255785544', NULL, NULL, NULL, '100.00', 1, NULL, NULL, NULL, NULL, NULL, NULL, NULL, '2947.50', '3153.75', '-6.25', '0.00', '0.00', 1, 0, '2021-04-17 04:12:25', '2021-06-03 12:49:39'),
(45, 2, NULL, 4, 'Miller', NULL, '7555885232', '7555885232', '7555885232', NULL, NULL, NULL, '100.00', 1, NULL, NULL, 'Dhaka,Bangladesh', NULL, NULL, NULL, NULL, '190448.75', '7242.50', '-325.00', '1765.00', '0.00', 1, 0, '2021-04-17 04:13:32', '2021-06-10 06:37:50'),
(46, NULL, NULL, NULL, 'Test', NULL, '122345', '122345', '122345', NULL, NULL, NULL, '550.00', 1, NULL, NULL, NULL, NULL, NULL, NULL, NULL, '1056.00', '1987.00', '-331.00', '0.00', '0.00', 1, 0, '2021-04-19 05:24:35', '2021-06-09 09:25:11'),
(47, NULL, NULL, NULL, 'Danial D.Flaung', 'X COMPANY', '01254788665', '01254788665', '01254788665', NULL, NULL, NULL, '0.00', 1, NULL, NULL, NULL, NULL, NULL, NULL, NULL, '1781.85', '1781.85', '0.00', '0.00', '0.00', 1, 0, '2021-04-26 09:19:23', '2021-04-27 06:11:40'),
(48, 2, NULL, NULL, 'ASBRM', NULL, '01312644409', '01312644409', '01312644409', NULL, NULL, NULL, '0.00', 1, NULL, 'Barpa, Rupshi, Rupganj, Naraynganj, Bangladesh-1460', NULL, NULL, NULL, NULL, NULL, '94250.00', '94250.00', '0.00', '0.00', '0.00', 1, 0, '2021-04-28 08:43:03', '2021-06-09 09:25:35'),
(49, NULL, NULL, NULL, 'RT', NULL, '122588', '122588', '122588', NULL, NULL, NULL, '0.00', 1, NULL, NULL, NULL, NULL, NULL, NULL, NULL, '425.00', '425.00', '0.00', '0.00', '0.00', 1, 0, '2021-04-28 12:26:07', '2021-06-09 09:27:00'),
(50, NULL, NULL, NULL, 'MT', NULL, '12558577', '12558577', '12558577', NULL, NULL, NULL, '0.00', 1, NULL, NULL, NULL, NULL, NULL, NULL, NULL, '0.00', '0.00', '0.00', '0.00', '0.00', 1, 0, '2021-04-28 12:27:36', '2021-04-28 12:27:36'),
(51, 2, NULL, NULL, 'hm', NULL, '147474', '147474', '147474', NULL, NULL, NULL, '0.00', 1, NULL, NULL, NULL, NULL, NULL, NULL, NULL, '2817.50', '2817.50', '0.00', '0.00', '0.00', 1, 0, '2021-04-28 12:28:32', '2021-06-10 06:37:28'),
(52, NULL, NULL, NULL, 'MT', NULL, '6574578878', '6574578878', '6574578878', NULL, NULL, NULL, '0.00', 1, NULL, NULL, NULL, NULL, NULL, NULL, NULL, '1023.75', '1023.75', '0.00', '0.00', '0.00', 1, 0, '2021-04-28 12:30:47', '2021-05-19 10:08:09'),
(53, NULL, NULL, NULL, 'Kayhel', NULL, '75558888', '75558888', '75558888', NULL, NULL, NULL, '2000.00', 1, NULL, NULL, NULL, NULL, NULL, NULL, NULL, '387.50', '2387.50', '0.00', '0.00', '0.00', 1, 0, '2021-04-28 12:31:11', '2021-05-06 09:56:56'),
(54, NULL, NULL, NULL, 'ou', NULL, '1000', '1000', '1000', NULL, NULL, NULL, '1000.00', 1, NULL, NULL, NULL, NULL, NULL, NULL, NULL, '8311.39', '16173.89', '0.00', '0.00', '0.00', 1, 0, '2021-05-02 10:27:50', '2021-06-09 08:56:54'),
(55, 2, NULL, NULL, 'Mr.Billarin', 'X Business', '01745865214', '01745865214', '01745865214', NULL, NULL, NULL, '2000.00', 1, NULL, NULL, NULL, NULL, NULL, NULL, NULL, '2316.56', '0.00', '0.00', '0.00', '0.00', 1, 0, '2021-05-09 04:02:53', '2021-06-07 09:41:46'),
(56, 3, 'A temporibus quod ei', 5, 'Janna Huber', 'Kylan Alvarado', '+1 (942) 854-1783', '+1 (942) 854-1783', '+1 (942) 854-1783', 'xygava@mailinator.com', '09-Jul-1976', '920', '86.00', 3, 675, 'Quo fuga Eu soluta', 'Aliqua Quam aut vel', 'Aut lorem tempore a', 'Sunt proident exer', 'Consequatur Mollit', '64557', '2887.50', '4400.00', '0.00', '0.00', '0.00', 1, 0, '2021-06-03 12:21:39', '2021-06-08 11:46:24'),
(57, 2, 'Sit laborum Est vol', 4, 'Joel Mcguire', 'Hilel Chan', '+1 (531) 725-2663', '+1 (531) 725-2663', '+1 (531) 725-2663', 'vyqalepaj@mailinator.com', '11-Nov-1990', '398', '88.00', 2, 259, 'Obcaecati dolore eli', 'Atque nulla id labo', 'Cupiditate iure ipsu', 'Officiis et fugit v', 'Incidunt sit volupt', '17477', '0.00', '0.00', '88.00', '0.00', '0.00', 1, 0, '2021-06-05 05:04:04', '2021-06-05 05:04:04'),
(58, 3, 'In sint minima est', 5, 'Lawrence Atkinson', 'Steven Carney', '+1 (869) 203-1139', '+1 (869) 203-1139', '+1 (869) 203-1139', 'lydohaju@mailinator.com', '30-Oct-1986', '904', '21.00', 3, 960, 'Veniam voluptas rep', 'Vero explicabo In e', 'Architecto voluptate', 'Quos ipsum excepturi', 'Sit duis dolor quam', '36148', '0.00', '21.00', '0.00', '0.00', '0.00', 1, 0, '2021-06-05 12:33:24', '2021-06-09 09:27:15'),
(61, NULL, NULL, NULL, 'Due customer', NULL, '12255447', '12255447', '12255447', NULL, NULL, NULL, '0.00', 1, NULL, NULL, NULL, NULL, NULL, NULL, NULL, '151462.50', '101462.50', '50000.00', '0.00', '0.00', 1, 0, '2021-06-10 06:02:01', '2021-06-17 10:44:49');

-- --------------------------------------------------------

--
-- Table structure for table `customer_groups`
--

CREATE TABLE `customer_groups` (
  `id` bigint(20) UNSIGNED NOT NULL,
  `group_name` varchar(255) COLLATE utf8mb4_unicode_ci NOT NULL,
  `calc_percentage` decimal(22,2) NOT NULL DEFAULT 0.00,
  `created_at` timestamp NULL DEFAULT NULL,
  `updated_at` timestamp NULL DEFAULT NULL
) ENGINE=InnoDB DEFAULT CHARSET=utf8mb4 COLLATE=utf8mb4_unicode_ci;

--
-- Dumping data for table `customer_groups`
--

INSERT INTO `customer_groups` (`id`, `group_name`, `calc_percentage`, `created_at`, `updated_at`) VALUES
(4, 'Premium Customer', '10.00', NULL, NULL),
(5, 'M Group', '15.00', NULL, '2021-04-21 10:45:53'),
(6, 'Silver Group', '70.00', NULL, '2021-04-21 10:19:49');

-- --------------------------------------------------------

--
-- Table structure for table `customer_ledgers`
--

CREATE TABLE `customer_ledgers` (
  `id` bigint(20) UNSIGNED NOT NULL,
  `customer_id` bigint(20) UNSIGNED DEFAULT NULL,
  `sale_id` bigint(20) UNSIGNED DEFAULT NULL,
  `sale_payment_id` bigint(20) UNSIGNED DEFAULT NULL,
  `money_receipt_id` bigint(20) UNSIGNED DEFAULT NULL,
  `row_type` tinyint(4) NOT NULL DEFAULT 1 COMMENT '1=sale;2=sale_payment;3=opening_balance;3=money_receipt',
  `amount` decimal(22,2) DEFAULT NULL COMMENT 'only_for_opening_balance',
  `is_advanced` tinyint(1) NOT NULL DEFAULT 0 COMMENT 'only_for_money_receipt',
  `created_at` timestamp NULL DEFAULT NULL,
  `updated_at` timestamp NULL DEFAULT NULL
) ENGINE=InnoDB DEFAULT CHARSET=utf8mb4 COLLATE=utf8mb4_unicode_ci;

--
-- Dumping data for table `customer_ledgers`
--

INSERT INTO `customer_ledgers` (`id`, `customer_id`, `sale_id`, `sale_payment_id`, `money_receipt_id`, `row_type`, `amount`, `is_advanced`, `created_at`, `updated_at`) VALUES
(2, 39, 14, NULL, NULL, 1, NULL, 0, '2021-04-10 11:15:05', '2021-04-10 11:15:05'),
(6, 39, 18, NULL, NULL, 1, NULL, 0, '2021-04-11 06:20:36', '2021-04-11 06:20:36'),
(7, 39, NULL, 4, NULL, 2, NULL, 0, '2021-04-11 06:20:36', '2021-04-11 06:20:36'),
(10, 39, 20, NULL, NULL, 1, NULL, 0, '2021-04-11 07:15:58', '2021-04-11 07:15:58'),
(11, 39, NULL, 6, NULL, 2, NULL, 0, '2021-04-11 07:15:58', '2021-04-11 07:15:58'),
(12, 39, 21, NULL, NULL, 1, NULL, 0, '2021-04-12 11:51:01', '2021-04-12 11:51:01'),
(13, 39, NULL, 7, NULL, 2, NULL, 0, '2021-04-12 11:51:02', '2021-04-12 11:51:02'),
(14, 39, 22, NULL, NULL, 1, NULL, 0, '2021-04-12 12:52:09', '2021-04-12 12:52:09'),
(15, 39, NULL, 8, NULL, 2, NULL, 0, '2021-04-12 12:52:09', '2021-04-12 12:52:09'),
(16, 39, 23, NULL, NULL, 1, NULL, 0, '2021-04-13 07:01:10', '2021-04-13 07:01:10'),
(17, 40, 24, NULL, NULL, 1, NULL, 0, '2021-04-17 03:47:27', '2021-04-17 03:47:27'),
(18, 40, NULL, 9, NULL, 2, NULL, 0, '2021-04-17 03:47:27', '2021-04-17 03:47:27'),
(19, 41, NULL, NULL, NULL, 3, '200.00', 0, '2021-04-17 04:05:36', '2021-04-17 04:05:36'),
(20, 42, NULL, NULL, NULL, 3, '500.00', 0, '2021-04-17 04:08:20', '2021-04-17 04:08:20'),
(21, 43, NULL, NULL, NULL, 3, '700.00', 0, '2021-04-17 04:10:35', '2021-04-17 04:10:35'),
(22, 44, NULL, NULL, NULL, 3, '100.00', 0, '2021-04-17 04:12:25', '2021-04-17 04:12:25'),
(23, 45, NULL, NULL, NULL, 3, '100.00', 0, '2021-04-17 04:13:32', '2021-04-17 04:13:32'),
(24, 45, 25, NULL, NULL, 1, NULL, 0, '2021-04-17 04:42:48', '2021-04-17 04:42:48'),
(26, 45, NULL, NULL, 35, 4, '400.00', 0, '2021-04-18 03:25:41', '2021-04-18 03:25:41'),
(31, 45, NULL, NULL, 36, 4, '100.00', 1, '2021-04-19 04:18:49', '2021-04-19 04:18:49'),
(32, 42, NULL, NULL, 37, 4, '500.00', 1, '2021-04-19 04:21:08', '2021-04-19 04:21:08'),
(33, 43, NULL, NULL, 38, 4, '700.00', 0, '2021-04-19 04:54:45', '2021-04-19 04:54:45'),
(34, 41, NULL, NULL, 40, 4, '200.00', 0, '2021-04-19 05:07:19', '2021-04-19 05:07:19'),
(35, 39, NULL, 15, NULL, 2, NULL, 0, '2021-04-19 05:10:18', '2021-04-19 05:10:18'),
(37, 39, NULL, NULL, 41, 4, '630.00', 1, '2021-04-19 05:10:18', '2021-04-19 05:10:18'),
(38, 46, NULL, NULL, NULL, 3, '550.00', 0, '2021-04-19 05:24:35', '2021-04-19 05:24:35'),
(39, 46, NULL, NULL, 42, 4, '400.00', 0, '2021-04-19 05:25:22', '2021-04-19 05:25:22'),
(40, 46, NULL, NULL, 43, 4, '50.00', 1, '2021-04-19 05:34:12', '2021-04-19 05:34:12'),
(41, 46, NULL, NULL, 43, 4, '150.00', 0, '2021-04-19 05:34:12', '2021-04-19 05:34:12'),
(42, 40, NULL, NULL, 44, 4, '100.00', 0, '2021-04-21 07:10:33', '2021-04-21 07:10:33'),
(43, 44, 29, NULL, NULL, 1, NULL, 0, '2021-04-25 11:46:06', '2021-04-25 11:46:06'),
(44, 44, NULL, 17, NULL, 2, NULL, 0, '2021-04-25 11:46:06', '2021-04-25 11:46:06'),
(45, 39, NULL, 19, NULL, 2, NULL, 0, '2021-04-25 13:16:33', '2021-04-25 13:16:33'),
(48, 45, NULL, 22, NULL, 2, NULL, 0, '2021-04-25 13:43:29', '2021-04-25 13:43:29'),
(49, 46, 31, NULL, NULL, 1, NULL, 0, '2021-04-26 07:40:51', '2021-04-26 07:40:51'),
(50, 46, NULL, 23, NULL, 2, NULL, 0, '2021-04-26 07:40:51', '2021-04-26 07:40:51'),
(51, 43, 33, NULL, NULL, 1, NULL, 0, '2021-04-26 07:45:32', '2021-04-26 07:45:32'),
(52, 43, NULL, 25, NULL, 2, NULL, 0, '2021-04-26 07:45:32', '2021-04-26 07:45:32'),
(53, 43, 34, NULL, NULL, 1, NULL, 0, '2021-04-26 07:45:39', '2021-04-26 07:45:39'),
(54, 43, NULL, 26, NULL, 2, NULL, 0, '2021-04-26 07:45:40', '2021-04-26 07:45:40'),
(55, 43, 35, NULL, NULL, 1, NULL, 0, '2021-04-26 07:45:40', '2021-04-26 07:45:40'),
(56, 43, NULL, 27, NULL, 2, NULL, 0, '2021-04-26 07:45:40', '2021-04-26 07:45:40'),
(57, 43, 36, NULL, NULL, 1, NULL, 0, '2021-04-26 07:45:41', '2021-04-26 07:45:41'),
(58, 43, NULL, 28, NULL, 2, NULL, 0, '2021-04-26 07:45:41', '2021-04-26 07:45:41'),
(59, 43, 37, NULL, NULL, 1, NULL, 0, '2021-04-26 07:45:46', '2021-04-26 07:45:46'),
(60, 43, NULL, 29, NULL, 2, NULL, 0, '2021-04-26 07:45:46', '2021-04-26 07:45:46'),
(61, 43, 38, NULL, NULL, 1, NULL, 0, '2021-04-26 07:45:48', '2021-04-26 07:45:48'),
(62, 43, NULL, 30, NULL, 2, NULL, 0, '2021-04-26 07:45:48', '2021-04-26 07:45:48'),
(63, 43, 39, NULL, NULL, 1, NULL, 0, '2021-04-26 07:46:34', '2021-04-26 07:46:34'),
(64, 43, NULL, 31, NULL, 2, NULL, 0, '2021-04-26 07:46:34', '2021-04-26 07:46:34'),
(65, 42, 40, NULL, NULL, 1, NULL, 0, '2021-04-26 08:07:38', '2021-04-26 08:07:38'),
(66, 42, NULL, 32, NULL, 2, NULL, 0, '2021-04-26 08:07:38', '2021-04-26 08:07:38'),
(67, 45, 43, NULL, NULL, 1, NULL, 0, '2021-04-26 08:20:34', '2021-04-26 08:20:34'),
(68, 45, NULL, 35, NULL, 2, NULL, 0, '2021-04-26 08:20:34', '2021-04-26 08:20:34'),
(69, 41, 44, NULL, NULL, 1, NULL, 0, '2021-04-26 08:23:00', '2021-04-26 08:23:00'),
(70, 41, NULL, 36, NULL, 2, NULL, 0, '2021-04-26 08:23:00', '2021-04-26 08:23:00'),
(71, 45, 45, NULL, NULL, 1, NULL, 0, '2021-04-26 09:39:31', '2021-04-26 09:39:31'),
(72, 45, NULL, 37, NULL, 2, NULL, 0, '2021-04-26 09:39:31', '2021-04-26 09:39:31'),
(73, 45, NULL, 38, NULL, 2, NULL, 0, '2021-04-26 10:48:17', '2021-04-26 10:48:17'),
(74, 47, 46, NULL, NULL, 1, NULL, 0, '2021-04-27 06:10:37', '2021-04-27 06:10:37'),
(75, 47, NULL, 39, NULL, 2, NULL, 0, '2021-04-27 06:10:37', '2021-04-27 06:10:37'),
(76, 41, 48, NULL, NULL, 1, NULL, 0, '2021-04-28 05:44:22', '2021-04-28 05:44:22'),
(77, 41, NULL, 40, NULL, 2, NULL, 0, '2021-04-28 05:44:22', '2021-04-28 05:44:22'),
(78, 48, 49, NULL, NULL, 1, NULL, 0, '2021-04-28 08:53:06', '2021-04-28 08:53:06'),
(79, 53, NULL, NULL, NULL, 3, '2000.00', 0, '2021-04-28 12:31:11', '2021-04-28 12:31:11'),
(80, 54, NULL, NULL, NULL, 3, '1000.00', 0, '2021-05-02 10:27:50', '2021-05-02 10:27:50'),
(81, 40, 50, NULL, NULL, 1, NULL, 0, '2021-05-02 10:44:58', '2021-05-02 10:44:58'),
(82, 40, NULL, 41, NULL, 2, NULL, 0, '2021-05-02 10:44:58', '2021-05-02 10:44:58'),
(83, 53, 51, NULL, NULL, 1, NULL, 0, '2021-05-04 04:56:24', '2021-05-04 04:56:24'),
(84, 53, NULL, 42, NULL, 2, NULL, 0, '2021-05-04 04:56:25', '2021-05-04 04:56:25'),
(85, 51, 58, NULL, NULL, 1, NULL, 0, '2021-05-04 05:09:15', '2021-05-04 05:09:15'),
(86, 51, NULL, 43, NULL, 2, NULL, 0, '2021-05-04 05:09:15', '2021-05-04 05:09:15'),
(87, 45, 64, NULL, NULL, 1, NULL, 0, '2021-05-05 08:48:37', '2021-05-05 08:48:37'),
(88, 45, 64, NULL, NULL, 1, NULL, 0, '2021-05-05 08:48:38', '2021-05-05 08:48:38'),
(89, 54, 74, NULL, NULL, 1, NULL, 0, '2021-05-08 11:18:04', '2021-05-08 11:18:04'),
(90, 54, 74, NULL, NULL, 1, NULL, 0, '2021-05-08 11:18:04', '2021-05-08 11:18:04'),
(91, 54, 85, NULL, NULL, 1, NULL, 0, '2021-05-08 12:50:50', '2021-05-08 12:50:50'),
(92, 54, 85, NULL, NULL, 1, NULL, 0, '2021-05-08 12:50:50', '2021-05-08 12:50:50'),
(93, 54, 86, NULL, NULL, 1, NULL, 0, '2021-05-08 12:50:58', '2021-05-08 12:50:58'),
(94, 54, 86, NULL, NULL, 1, NULL, 0, '2021-05-08 12:50:58', '2021-05-08 12:50:58'),
(95, 54, 87, NULL, NULL, 1, NULL, 0, '2021-05-08 12:53:18', '2021-05-08 12:53:18'),
(96, 54, 87, NULL, NULL, 1, NULL, 0, '2021-05-08 12:53:18', '2021-05-08 12:53:18'),
(97, 54, 88, NULL, NULL, 1, NULL, 0, '2021-05-08 12:53:33', '2021-05-08 12:53:33'),
(98, 54, 88, NULL, NULL, 1, NULL, 0, '2021-05-08 12:53:33', '2021-05-08 12:53:33'),
(99, 54, 89, NULL, NULL, 1, NULL, 0, '2021-05-08 12:54:44', '2021-05-08 12:54:44'),
(100, 54, 89, NULL, NULL, 1, NULL, 0, '2021-05-08 12:54:44', '2021-05-08 12:54:44'),
(101, 54, 90, NULL, NULL, 1, NULL, 0, '2021-05-08 12:54:46', '2021-05-08 12:54:46'),
(102, 54, 90, NULL, NULL, 1, NULL, 0, '2021-05-08 12:54:46', '2021-05-08 12:54:46'),
(103, 54, 92, NULL, NULL, 1, NULL, 0, '2021-05-08 12:58:02', '2021-05-08 12:58:02'),
(104, 54, 92, NULL, NULL, 1, NULL, 0, '2021-05-08 12:58:02', '2021-05-08 12:58:02'),
(105, 54, NULL, 53, NULL, 2, NULL, 0, '2021-05-08 12:58:02', '2021-05-08 12:58:02'),
(106, 54, 93, NULL, NULL, 1, NULL, 0, '2021-05-08 12:58:16', '2021-05-08 12:58:16'),
(107, 54, 93, NULL, NULL, 1, NULL, 0, '2021-05-08 12:58:16', '2021-05-08 12:58:16'),
(108, 54, 94, NULL, NULL, 1, NULL, 0, '2021-05-08 12:58:34', '2021-05-08 12:58:34'),
(109, 54, 94, NULL, NULL, 1, NULL, 0, '2021-05-08 12:58:34', '2021-05-08 12:58:34'),
(110, 54, 95, NULL, NULL, 1, NULL, 0, '2021-05-08 12:58:39', '2021-05-08 12:58:39'),
(111, 54, 95, NULL, NULL, 1, NULL, 0, '2021-05-08 12:58:39', '2021-05-08 12:58:39'),
(112, 54, 96, NULL, NULL, 1, NULL, 0, '2021-05-08 12:58:53', '2021-05-08 12:58:53'),
(113, 54, 96, NULL, NULL, 1, NULL, 0, '2021-05-08 12:58:53', '2021-05-08 12:58:53'),
(114, 54, NULL, 54, NULL, 2, NULL, 0, '2021-05-08 12:58:53', '2021-05-08 12:58:53'),
(115, 54, 97, NULL, NULL, 1, NULL, 0, '2021-05-08 12:59:05', '2021-05-08 12:59:05'),
(116, 54, 97, NULL, NULL, 1, NULL, 0, '2021-05-08 12:59:05', '2021-05-08 12:59:05'),
(117, 54, 98, NULL, NULL, 1, NULL, 0, '2021-05-08 12:59:15', '2021-05-08 12:59:15'),
(118, 54, 98, NULL, NULL, 1, NULL, 0, '2021-05-08 12:59:15', '2021-05-08 12:59:15'),
(119, 54, 99, NULL, NULL, 1, NULL, 0, '2021-05-08 13:04:43', '2021-05-08 13:04:43'),
(120, 54, 99, NULL, NULL, 1, NULL, 0, '2021-05-08 13:04:43', '2021-05-08 13:04:43'),
(121, 54, NULL, 55, NULL, 2, NULL, 0, '2021-05-08 13:04:43', '2021-05-08 13:04:43'),
(122, 54, NULL, 56, NULL, 2, NULL, 0, '2021-05-08 13:04:43', '2021-05-08 13:04:43'),
(123, 54, NULL, 57, NULL, 2, NULL, 0, '2021-05-08 13:04:43', '2021-05-08 13:04:43'),
(124, 54, 102, NULL, NULL, 1, NULL, 0, '2021-05-08 13:11:24', '2021-05-08 13:11:24'),
(125, 54, 102, NULL, NULL, 1, NULL, 0, '2021-05-08 13:11:24', '2021-05-08 13:11:24'),
(126, 54, NULL, 60, NULL, 2, NULL, 0, '2021-05-08 13:11:24', '2021-05-08 13:11:24'),
(127, 54, 103, NULL, NULL, 1, NULL, 0, '2021-05-08 13:12:46', '2021-05-08 13:12:46'),
(128, 54, 103, NULL, NULL, 1, NULL, 0, '2021-05-08 13:12:46', '2021-05-08 13:12:46'),
(129, 54, NULL, 61, NULL, 2, NULL, 0, '2021-05-08 13:12:46', '2021-05-08 13:12:46'),
(130, 54, 118, NULL, NULL, 1, NULL, 0, '2021-05-08 13:44:55', '2021-05-08 13:44:55'),
(131, 54, 118, NULL, NULL, 1, NULL, 0, '2021-05-08 13:44:55', '2021-05-08 13:44:55'),
(132, 54, 119, NULL, NULL, 1, NULL, 0, '2021-05-08 13:45:24', '2021-05-08 13:45:24'),
(133, 54, 119, NULL, NULL, 1, NULL, 0, '2021-05-08 13:45:24', '2021-05-08 13:45:24'),
(137, 54, NULL, 77, NULL, 2, NULL, 0, '2021-05-08 13:45:53', '2021-05-08 13:45:53'),
(138, 54, NULL, 78, NULL, 2, NULL, 0, '2021-05-08 13:45:53', '2021-05-08 13:45:53'),
(139, 54, NULL, 79, NULL, 2, NULL, 0, '2021-05-08 13:45:53', '2021-05-08 13:45:53'),
(140, 54, NULL, 80, NULL, 2, NULL, 0, '2021-05-08 13:45:53', '2021-05-08 13:45:53'),
(142, 55, NULL, NULL, NULL, 3, '2000.00', 0, '2021-05-09 04:02:53', '2021-05-09 04:02:53'),
(143, 54, 133, NULL, NULL, 1, NULL, 0, '2021-05-09 12:32:55', '2021-05-09 12:32:55'),
(144, 54, 133, NULL, NULL, 1, NULL, 0, '2021-05-09 12:32:55', '2021-05-09 12:32:55'),
(145, 54, NULL, 82, NULL, 2, NULL, 0, '2021-05-09 12:32:55', '2021-05-09 12:32:55'),
(146, 54, 134, NULL, NULL, 1, NULL, 0, '2021-05-09 12:51:45', '2021-05-09 12:51:45'),
(147, 55, 136, NULL, NULL, 1, NULL, 0, '2021-05-09 13:02:56', '2021-05-09 13:02:56'),
(148, 55, 136, NULL, NULL, 1, NULL, 0, '2021-05-09 13:02:56', '2021-05-09 13:02:56'),
(149, 55, NULL, 84, NULL, 2, NULL, 0, '2021-05-09 13:02:56', '2021-05-09 13:02:56'),
(150, 39, 146, NULL, NULL, 1, NULL, 0, '2021-05-11 03:25:55', '2021-05-11 03:25:55'),
(151, 39, 146, NULL, NULL, 1, NULL, 0, '2021-05-11 03:25:55', '2021-05-11 03:25:55'),
(152, 39, 147, NULL, NULL, 1, NULL, 0, '2021-05-11 03:30:38', '2021-05-11 03:30:38'),
(153, 39, 147, NULL, NULL, 1, NULL, 0, '2021-05-11 03:30:38', '2021-05-11 03:30:38'),
(154, 43, 156, NULL, NULL, 1, NULL, 0, '2021-05-18 07:23:29', '2021-05-18 07:23:29'),
(155, 43, 156, NULL, NULL, 1, NULL, 0, '2021-05-18 07:23:29', '2021-05-18 07:23:29'),
(156, 45, 157, NULL, NULL, 1, NULL, 0, '2021-05-18 07:26:26', '2021-05-18 07:26:26'),
(157, 45, 157, NULL, NULL, 1, NULL, 0, '2021-05-18 07:26:26', '2021-05-18 07:26:26'),
(158, 45, NULL, 121, NULL, 2, NULL, 0, '2021-05-18 07:26:26', '2021-05-18 07:26:26'),
(159, 49, 158, NULL, NULL, 1, NULL, 0, '2021-05-18 07:32:40', '2021-05-18 07:32:40'),
(160, 49, 158, NULL, NULL, 1, NULL, 0, '2021-05-18 07:32:40', '2021-05-18 07:32:40'),
(161, 49, NULL, 122, NULL, 2, NULL, 0, '2021-05-18 07:32:40', '2021-05-18 07:32:40'),
(162, 40, 159, NULL, NULL, 1, NULL, 0, '2021-05-18 09:28:34', '2021-05-18 09:28:34'),
(163, 40, 159, NULL, NULL, 1, NULL, 0, '2021-05-18 09:28:34', '2021-05-18 09:28:34'),
(164, 40, NULL, 123, NULL, 2, NULL, 0, '2021-05-18 09:28:34', '2021-05-18 09:28:34'),
(165, 52, 167, NULL, NULL, 1, NULL, 0, '2021-05-19 10:08:09', '2021-05-19 10:08:09'),
(166, 52, NULL, 132, NULL, 2, NULL, 0, '2021-05-19 10:08:09', '2021-05-19 10:08:09'),
(167, 54, 168, NULL, NULL, 1, NULL, 0, '2021-05-19 10:13:18', '2021-05-19 10:13:18'),
(168, 54, NULL, 133, NULL, 2, NULL, 0, '2021-05-19 10:13:18', '2021-05-19 10:13:18'),
(169, 54, 169, NULL, NULL, 1, NULL, 0, '2021-05-19 10:13:43', '2021-05-19 10:13:43'),
(170, 54, NULL, 134, NULL, 2, NULL, 0, '2021-05-19 10:13:43', '2021-05-19 10:13:43'),
(171, 51, 170, NULL, NULL, 1, NULL, 0, '2021-05-19 10:15:19', '2021-05-19 10:15:19'),
(172, 51, NULL, 135, NULL, 2, NULL, 0, '2021-05-19 10:15:19', '2021-05-19 10:15:19'),
(173, 55, 174, NULL, NULL, 1, NULL, 0, '2021-05-24 05:50:13', '2021-05-24 05:50:13'),
(174, 55, NULL, 139, NULL, 2, NULL, 0, '2021-05-24 05:50:13', '2021-05-24 05:50:13'),
(175, 55, 175, NULL, NULL, 1, NULL, 0, '2021-05-24 05:53:25', '2021-05-24 05:53:25'),
(176, 55, NULL, 140, NULL, 2, NULL, 0, '2021-05-24 05:53:25', '2021-05-24 05:53:25'),
(177, 41, 176, NULL, NULL, 1, NULL, 0, '2021-06-01 13:24:46', '2021-06-01 13:24:46'),
(178, 41, 176, NULL, NULL, 1, NULL, 0, '2021-06-01 13:24:46', '2021-06-01 13:24:46'),
(184, 39, 180, NULL, NULL, 1, NULL, 0, '2021-06-02 12:27:21', '2021-06-02 12:27:21'),
(191, 39, 184, NULL, NULL, 1, NULL, 0, '2021-06-02 12:34:22', '2021-06-02 12:34:22'),
(192, 39, 185, NULL, NULL, 1, NULL, 0, '2021-06-02 12:35:27', '2021-06-02 12:35:27'),
(193, 39, 186, NULL, NULL, 1, NULL, 0, '2021-06-02 12:37:47', '2021-06-02 12:37:47'),
(198, 41, NULL, 144, NULL, 2, NULL, 0, '2021-06-03 07:32:38', '2021-06-03 07:32:38'),
(199, 42, 191, NULL, NULL, 1, NULL, 0, '2021-06-03 07:51:43', '2021-06-03 07:51:43'),
(200, 42, 191, NULL, NULL, 1, NULL, 0, '2021-06-03 07:51:43', '2021-06-03 07:51:43'),
(201, 42, NULL, 145, NULL, 2, NULL, 0, '2021-06-03 07:51:44', '2021-06-03 07:51:44'),
(202, 42, NULL, 146, NULL, 2, NULL, 0, '2021-06-03 07:55:22', '2021-06-03 07:55:22'),
(203, 49, NULL, 147, NULL, 2, NULL, 0, '2021-06-03 08:00:48', '2021-06-03 08:00:48'),
(204, 56, NULL, NULL, NULL, 3, '86.00', 0, '2021-06-03 12:21:39', '2021-06-03 12:21:39'),
(205, 44, 193, NULL, NULL, 1, NULL, 0, '2021-06-03 12:36:11', '2021-06-03 12:36:11'),
(206, 44, 193, NULL, NULL, 1, NULL, 0, '2021-06-03 12:36:12', '2021-06-03 12:36:12'),
(207, 44, NULL, 148, NULL, 2, NULL, 0, '2021-06-03 12:36:12', '2021-06-03 12:36:12'),
(208, 44, NULL, 149, NULL, 2, NULL, 0, '2021-06-03 12:49:39', '2021-06-03 12:49:39'),
(209, 51, 195, NULL, NULL, 1, NULL, 0, '2021-06-03 13:11:16', '2021-06-03 13:11:16'),
(210, 51, 195, NULL, NULL, 1, NULL, 0, '2021-06-03 13:11:16', '2021-06-03 13:11:16'),
(211, 51, NULL, 153, NULL, 2, NULL, 0, '2021-06-03 13:11:16', '2021-06-03 13:11:16'),
(212, 51, NULL, 154, NULL, 2, NULL, 0, '2021-06-03 13:12:29', '2021-06-03 13:12:29'),
(213, 51, NULL, 155, NULL, 2, NULL, 0, '2021-06-03 13:14:09', '2021-06-03 13:14:09'),
(214, 54, 196, NULL, NULL, 1, NULL, 0, '2021-06-03 13:21:23', '2021-06-03 13:21:23'),
(215, 54, 196, NULL, NULL, 1, NULL, 0, '2021-06-03 13:21:23', '2021-06-03 13:21:23'),
(216, 54, NULL, 156, NULL, 2, NULL, 0, '2021-06-03 13:21:23', '2021-06-03 13:21:23'),
(217, 54, NULL, 157, NULL, 2, NULL, 0, '2021-06-03 13:22:00', '2021-06-03 13:22:00'),
(218, 46, 198, NULL, NULL, 1, NULL, 0, '2021-06-03 13:25:26', '2021-06-03 13:25:26'),
(219, 46, 198, NULL, NULL, 1, NULL, 0, '2021-06-03 13:25:26', '2021-06-03 13:25:26'),
(220, 46, NULL, 159, NULL, 2, NULL, 0, '2021-06-03 13:25:26', '2021-06-03 13:25:26'),
(221, 46, NULL, 160, NULL, 2, NULL, 0, '2021-06-03 13:26:04', '2021-06-03 13:26:04'),
(222, 46, NULL, 161, NULL, 2, NULL, 0, '2021-06-03 13:26:45', '2021-06-03 13:26:45'),
(223, 57, NULL, NULL, NULL, 3, '88.00', 0, '2021-06-05 05:04:04', '2021-06-05 05:04:04'),
(224, 58, NULL, NULL, NULL, 3, '21.00', 0, '2021-06-05 12:33:24', '2021-06-05 12:33:24'),
(225, 55, 203, NULL, NULL, 1, NULL, 0, '2021-06-06 07:23:19', '2021-06-06 07:23:19'),
(226, 55, NULL, 170, NULL, 2, NULL, 0, '2021-06-06 07:23:19', '2021-06-06 07:23:19'),
(227, 46, 205, NULL, NULL, 1, NULL, 0, '2021-06-06 08:29:28', '2021-06-06 08:29:28'),
(228, 46, NULL, 172, NULL, 2, NULL, 0, '2021-06-06 08:29:28', '2021-06-06 08:29:28'),
(229, 51, 206, NULL, NULL, 1, NULL, 0, '2021-06-06 11:22:47', '2021-06-06 11:22:47'),
(230, 51, 206, NULL, NULL, 1, NULL, 0, '2021-06-06 11:22:47', '2021-06-06 11:22:47'),
(231, 46, 208, NULL, NULL, 1, NULL, 0, '2021-06-07 11:41:46', '2021-06-07 11:41:46'),
(232, 46, 208, NULL, NULL, 1, NULL, 0, '2021-06-07 11:41:46', '2021-06-07 11:41:46'),
(233, 41, 224, NULL, NULL, 1, NULL, 0, '2021-06-08 11:08:25', '2021-06-08 11:08:25'),
(234, 41, 224, NULL, NULL, 1, NULL, 0, '2021-06-08 11:08:25', '2021-06-08 11:08:25'),
(235, 40, 225, NULL, NULL, 1, NULL, 0, '2021-06-08 11:09:27', '2021-06-08 11:09:27'),
(236, 40, 225, NULL, NULL, 1, NULL, 0, '2021-06-08 11:09:27', '2021-06-08 11:09:27'),
(237, 56, 226, NULL, NULL, 1, NULL, 0, '2021-06-08 11:27:11', '2021-06-08 11:27:11'),
(238, 56, NULL, 189, NULL, 2, NULL, 0, '2021-06-08 11:27:11', '2021-06-08 11:27:11'),
(239, 56, 227, NULL, NULL, 1, NULL, 0, '2021-06-08 11:27:17', '2021-06-08 11:27:17'),
(240, 56, NULL, 190, NULL, 2, NULL, 0, '2021-06-08 11:27:17', '2021-06-08 11:27:17'),
(241, 56, 228, NULL, NULL, 1, NULL, 0, '2021-06-08 11:28:08', '2021-06-08 11:28:08'),
(242, 56, NULL, 191, NULL, 2, NULL, 0, '2021-06-08 11:28:08', '2021-06-08 11:28:08'),
(243, 56, 229, NULL, NULL, 1, NULL, 0, '2021-06-08 11:29:18', '2021-06-08 11:29:18'),
(244, 56, NULL, 192, NULL, 2, NULL, 0, '2021-06-08 11:29:18', '2021-06-08 11:29:18'),
(245, 56, 230, NULL, NULL, 1, NULL, 0, '2021-06-08 11:31:29', '2021-06-08 11:31:29'),
(246, 56, NULL, 193, NULL, 2, NULL, 0, '2021-06-08 11:31:29', '2021-06-08 11:31:29'),
